title,story
판타지 괴물원,"이세계의 모든 이종족들을 전시하는 몬스터판 동물원, 판타지 괴물원에서의 일상을 그립니다/10일 주.."
콜맨,미친놈이 그린 미친만화 옴니버스식 스토리
터닝 포인트,자신과 똑같은 나이의 아들과 만나게 된다면?
물 좀 뿌려주세요,30년 모쏠 라라의 개박하 농사+모쏠탈출 성공기.
어서와 유치원은 처음이지,"유치원이라는 세상에서 아이도, 엄마도, 가족들도 자란다! 유쾌발랄 좌충우돌 일상공감 육아 웹툰"
스무살에 여동생이 생겼다,"""스무살에, 여동생이 하나 더 생겼다"". 한 소년의 아픔과 사랑의 이야기."
이해하면 무서운 그림,그림 속 공포스토리를 추리해 보세요.
동두고,중년 고릴라의 생각
동생들을 사랑하게 해주세요,남동생 두명을 갖게된 주인공 이야기
벨라,어느날 갑자기 영화같은일들에 엮이게 된 이야기
레츠꼬 보라카이,3박 5일 보라카이 여행기
반지의기사들,그들의 이야기
소원을 말해봐,현대판 지니와의 로맨스 (자유연재)
oh 버드 크라이스트,내 취향의 남자는 왜 다 이 모양이지? 새를 사랑하는 남자와 연애하기 위한 소희의 분투기.
쓸모없고 가치있는,"일상시트콤, 무한자아성찰, 친구들"
잉글리쉬 하우스와이프,"전업주부, 풀타임맘으로 영국에서 살아가는 한국아줌마의 일상이야기."
쮸쮸몬,"2018 황금개띠로 태어난 ""쮸쮸몬"" 초보 엄빠의 좌충우돌 공동육아 프로젝트~!"
수능보는날,"수능보는날 아침, 진수는 라이벌이었던 영석에게 질투심으로 심한 장난을 치게 되는데.."
괴물박명,어른들의 과욕이 부른 대참사! 괴물이 된 학생들과 살아남은 학생들의 이야기
저스티스 하이스쿨,-학원변신히어로액션- <저스티스 하이스쿨>
학교라는 이름의 감옥,"일부학생(일진)을 비판하는 이야기는 많지만, 일부 학교나 일부 선생님을 비판하는 웹툰은 없어서 만.."
여우야 여우야 뭐하니,남자 한번 제대로 만나본 적 없는 20살 여대생 앞에 나타난 여우...? 그런데 그냥 여우가 아니..
운우풍뢰,세계 사물놀이 겨루기돼회 참가를 위해 토론토 에서 5팀이 경언을 펼치게 되어 선발된 팀이 한국으..
쏠씨인생,흥많고 즐거운 쏠씨의 일상이야기
소년 소녀의 흥얼거림,초능력을 갖고있는 소년과 평범한 소녀의 이야기
IMPERFECT 상상편,안과 밖으로 나눠진 세상에서 태어난 쓰레기를 먹는 나무 라니티딘의 이야기.
닥터 돌피노의 배두루미 병원,숭악한 돌고래 의사 돌피노의 이야기!
씽씽싱가포르,동갑내기 친구의 첫 해외여행! 씽씽싱가포르!
소년이여 일어나라,이세계의 소년은 어디까지 갈수 있을까??
우리들의 작은일상,지극히 일상적인 우리들의 작은 이야기
머리카락을 뽑으면,"머리카락이 빠지면 기억을 잃어버리는 여중생 ‘이지은’, 방학 동안 잃어버린 기억을 찾아가다."
청부업자와 소년의 이야기,귀신이라 불리는 청부업자 주드와 거리에 버려진 고아 노바가 살아가는 척박하고 삭막한 세상 이야기
둥이와 나의 추억앨범,나의 사랑둥이를 추억하는 앨범
당신의 한 순간,"찰칵, 위로가 필요한 당신에게"
업로드 연습용,업로드 연습용
다개키말,실화를 바탕으로 한 반려견과의 이야기
심야알바,만화가의 맥주집 알바 이야기
백투더하이스쿨,고등학교 시절을 되돌아보며 고등학교를 다니며 느꼈던 생생한 감정전달~
탕과장life,덕후들이 모인 회사에서 생존하는 머글 탕과장 이야기라고 쓰고 생활툰이라 이해합니다 :)
엄마공감 소유툰,엄마공감 육아툰! 두 아들과 함께하는 와글바글한 일상이야기
고어,"이 세계는 평범해 보이지만 그곳에는 3~5년에 한 번씩 이계의 사람, 아니면 괴물이 출몰한다."
리클레임RECLAIM,결여되고 어긋난 소년소녀의 이야기
죽음이 있는곳에 가는 아이,죽은사람들이 있는곳에 가서 이야기를 듣고 영혼을 떠나게 하는 아이
눈텡이,나름 볼만한 막장병맛 웹툰!!
12지신 동물농장,사주 웹툰은 처음이지? 십이지신 동물들이 알려주는 당신의 성격과 성향에 대한 짧은 이야기.
나녕일기,귀엽고 재미있게 담아낸 '전지적 나녕이 시점' 일상툰 <나녕일기>
우투리전,.
인형의 연,인연을 끊을 수 있는 남자와 그로인해 인연이 끊긴 여자의 이야기.
중소기업만화,스펙제로의 사원 오우야의 중소기업 생존기
환향,어머니의 장례를 위해 마을로 내려온 아민은 그 곳에서 죽은 옛 친구 례화를 만나는데..
박푸른 가족,"오빠 넷, 막내여동생 하나"
일상이 왜고래,"고래와 주변친구들의 소소하고, 때론 멘탈이 나가는 일상 라이프"
인팁의 사생활,MBTI 검사결과 INTP가 나온 사람의 자잘한 일상들.
나비 이야기,식물을 빨리 성장시킬 수 있는 능력을 가진 평범한 소년이 갑자기 재판을 받으며 겪는 작은 이야기.
드림시티,*개인 사정으로 2년가량만 장기 휴재 후 리메이크를 할 예정입니다. 기다려주신 독자님들께 죄송합니..
아시람,"산좋고 물좋은 곳에 위치한 인성교육 중심의 대안학교, 아시람고에 재일교포 용이가 전학오게 되는데"
가스캡틴 쁑이,방귀냄새가 지독한 쁑이의 곶통을 함께 나누는 친구들 이야기
EGG BOI,달걀소년 인간사회 적응기
나는 스타트업 대표,대표 하양이의 창업일상
그들이 사는 세상,국립 영재고등학교에 간신히 입학했지만 첫 중간고사에서 꼴찌를 한 유원에게 수상한 편지가 오는데....
에고,가상현실 게임이 무대입니다.
하늘의 별,"정말 하늘의 별 같은 별이를 좋아하는 하늘의 짝사랑이야기, 하지만 하늘은 이미..."
일상법률툰,일상에서 벌어지는 다양한 법적 분쟁들. 재미로 보는 야매 생활법률툰! 매주 토요일 연재
외눈 인생,"작은 공책 안, 어딘가 하나씩 부족한 주인공들의 삶"
해파리 블루스,해파리 둥실이의 모험
먹날,어쨋든 소년만화
SWIM SWIM,"혹시 수영 좋아하세요? 네, 좋아합니다!"
고독한 애견가,평소 시간이 없어 반려동물은 꿈도 못 꾸는 직장인의 대리만족 애견카페 탐방기.
INK,27세에 사망하여 빛과 어둠의 관리자가 된 처자(處子)의 이야기.
내남편은MADEINCHINA,중국남편 장삼&한국마눌 이사가 펼치는 초현실주의 신혼일기 in 양꼬치는 칭따오!
너와하고싶다,과거로 간 남자의 첫사랑 쟁취기
감성일기,소소하고 평범하지만 왠지 모르게 마음 한 켠이 따뜻해지는 그런 이야기를 하고 싶어요.
차원 무역회사 평담사,수많은 세계를 이동할 수 있는 구멍과 그 위에 지어진 한 회사 이곳에 입사한 한 남자의 이야기
팀의 색깔,불완전한 시기의 소년 소녀들이 이끌어가는 축구부
만사오케이,핵전쟁 이후의 세계를 여행하는 소녀들의 이야기를 그린 가볍게 보는 포스트아포칼립스 !
별빛지기,나도 멋진 영웅이 되고 싶어! 한 소년과 친구와 별들의 꿈을 이루려는 이야기.
헬58,범죄자들이 추방되는 최악의 무법지대 58아일랜드... 속칭 헬58에서 벌어지는 사연있는 자들의 ..
혼란의 후야,우리는 그들을 두려워 하기에 마주할 수 없다. 귀신을 마주하는 소년의 이야기
나만 그래,집안안과 집밖의 모습이 전혀 다른 부부의 별일 아닌 이야기입니다.
1004호 소녀,1004호 소녀..
제노,SF 판타지
고스트 뱀파이어,흡혈귀인 재하와 유령인 하나의 동거 생활
오늘도 여행 중,여행을 결정하는 순간. 여행 요정이 우리의 몸 속으로 들어온다 !
소울 키친,소울키친에서 펼쳐지는 사랑하는 사람과의 특별한 소울푸드 이야기
블라인드 러너,시각장애를 갖고 있는 유진은 체육대회 계주에 참여하고 싶어하지만 담임선생님의 반대에 부딛친다.
영어왕,왜 영어 공부를 했는데도 말은 안 나오는 걸까? 10년간 좇아온 질문에 대한 해답을 찾아서...
카인의 후예들,형제살해가 일상이자 의무인 그곳에서 살아남기 위해 도망친 황자와 예니체리. 그들의 운명은?
용의 첫사랑,.
알잖아 난 말야,이야기보따리 영차! (매주 수)
앵글러,낚시초짜에서 프로까지 그의 낚시 인생 이야기가 지금 시작합니다.
여기는 동대문 입니다,디자이너에 대한 원대한 꿈을 안고 서울로 상경한 풀잎 24살 늦은나이에 막내디자이너가 된 그녀
내 남자친구는 저승사자,1년 전 죽었던 내 남자친구가 나를 데리러 온 저승사자가 되어서 찾아왔다!
끔찍한 이야기,끔찍한 이야기들 단편선입니다.
꼬달s 관찰기,처절한 인생 첫 육아!!
루비왕국,"루비공주와 다섯 남자의 개그 로맨스물 입니다^^/업로드는 매주 월요일,금요일 예정입니다."
망령 왕이,성장형 대마왕
뭐 먹고 살지,우리 졸업해서 뭐 먹고 살지? 미대생 뽀의 이런저런 일상 이야기
BETWEEN,Between A and B
신들의 꽃,신의 사랑을 받게 된 소녀의 뒤엉킨 운명과 사랑. 그리고 잔인하고도 아름다운 신들의 이야기.
무지개를 준 아이,단편으로 된 이야기입니다
사람이 되었습니다,어느 날 갑자기 사람이 되어버린 반려견. 주인을 찾기 위해 집밖으로 나가는데
개왕나니,"조선의 왕과 기생, 시간 이동후 '국민여배우'와 '국민쌍놈'으.."
시엘의 진실,네가 하는 말이 너의 삶이 된다.
죄인의 시간,평범한 고3 안재인의 앞에 탈세상급 미남이 나타난다. 그로 인해 재인의 수험생활은 조금씩 꼬이게 ..
킬미힐미,성 폭행
지실,한 섬에서 벌어진 재앙과 사투를 그린 이야기 입니다.
늑대지얌 폴아웃 더 오리진,늑대지얌 패밀리가 폴아웃 세계에 왔다! 핵전쟁 이후 멸망한 세계에서 펼쳐지는 좌충우돌 스토리!
찾아봐,"범인이 누군지 찾아보는 추리 스릴러물! 이 작품은 옴니버스로 연재되며, 작가가 방학을 하여 여유있.."
어떻게 살아요,"하라는대로 살아온 주인공 서라! 취직 전에는 모범생, 회사에선 호구! 이 힘든 세상 어떻게 살아요.."
호두망고,호두와 망고의 신혼일기 :)
쓰푼,고양이 나나의 세계여행! 계획없이 무작정 시작 된 세계여행을 통해 사랑과 자아를 찾아가는 이야기.
귀신산,유명세를 얻고자 산의 미스테리를 파헤치기 위해 등산하는 한 남자의 이야기.
용사녀석 마왕님,꼬마 마왕을 보살피는 백수 용사의 이야기
우중산책,"장마의 첫날, 우비를 입고 쏟아지는 비를 맞으며 길을 걷는다."
러보얌 시즌2,알콩달콩 4차원 부부이야기 러보얌 시즌2!!!!
전기차 이바구,"1년, 4만km 전기차를 타며 몸소 겪은 경험담과 주변 이야기들을 웹툰에 담았습니다."
혼잣말,솔직하고 꾸밈없는 10컷 만화. 어쩌면 당신의 이야기.
호신,호랑이에게 길러진 인간 모구리. 그는 과연 시대를 구원 할 수 있을까.
스트리트킹,일상 농구동호회 이야기 입니다.
고넹스토리,개구쟁이 고넹스토리
만렙주부되는법,결혼생활 초보인데다 임신하여 엄마가 된 아꾸가 경험해 나가고 성장해나가는 일상 이야기이다.
프로짝사랑러,짝사랑하기만 하면 상대가 커플이되는 징크스를 가진 모태솔로 이야기
am pm,"28(스물 여덟), 내가 곰신이라니 !!! 늦깎이 곰신이 되기까지, 그리고 군화와 곰신의 이야기를.."
ODER MADE,"섬마을을 벗어나고 싶어하는 공방의 소년, 섬마을을 방문한 귀족을 만나 생기는 이야기"
성스러운 순간,"21세기 현대의 내 인생과 사자성어의 만남, 그리고 누군가가 만날, 성스러운 순간."
파닥 노란생선,시골 생선의 서울 적응기
홍 紅,홍의 이야기. ( 웹툰 꿈의대화 스핀오프 시리즈 )
쥐구멍플리즈,궁핍하고 쪽팔린 일상! 본격실화코믹일상 쥐구멍에 숨고 싶을때 놀러오세요~
기억하는금붕어와까먹는고양이,"말해줄게요, 함께 있는 동안에"
생활희극인 가족,생활희극인 가족 https://brunch.co.kr/@alohwangaloha
너는 나의 프리존,마음이 여린 난이는 일상에서 겪는 마음의 상처에 아파한다. 그런 난이 앞에 중절모를 쓴 토끼가 나..
시간의 성,시간수집자와 인간의 이야기
요양일기,무리한 직장생활과 스트레스로 삶에 과부하가 걸린 여주는 결국 쓰러지고 아빠의 부름에 시골로 요양을..
까칠한 시선,카페에서 벌어지는 선인장과 동그라미의 까칠한 감성툰
내이름은 깜또노,"깜또노의 일상이야기, 사실은 작가의 감성일기"
블루베리 요거트,고등학교 2학년 은지의 심상치 않은 학교생활
청춘여행 5000분의1,평범한 일상 속에서 일탈을 꿈꾸는 청춘들의 여행을 통해 설렘을 나누는 공감 여행툰.
셋이 모여 202,세 작가가 202호에 모였다! 그리고 탄생한 202스튜디오! 202스튜디오의 탄생부터 각종 사건사..
러브에페,"스물아홉 모솔 정소정, 펜싱을 시작하다? 짝사랑하던 대리님과 잘 되가던 찰나, 그녀 앞에 장애물이.."
건빵이 일기,신혼 2년차 새식구가 생겼다. 고양이 건빵이와 함께 하는 신혼 일기
겨울나방,"""작은 촛불의 빛이 얼마나 멀리 퍼지는가?(William Shakespeare)"".."
묘묘네에서 매일매일,엉뚱발랄 일상툰입니다. 8컷툰으로 매주수요일 연재입니다!
초혼의 경계,저승 탈출 판타지
묵인,주인공 동현이 학교폭력을 경험하는 내용입니다.
서툰 이야기,지금도 어딘가에서 살아가고 있을 '나'의 이야기.
너에게쓰는마지막편지,miss u/너를잃고 너를그리워하다
고요가 찾아오면,세상의 고장난 시계를 관리하게 된 평범한 대학생. 그의 지루하고 또 지루한 회색빛 삶이 파란 고요..
독백,우울한 청춘
호박마녀와 도깨비집사,100년만에 깨어난 도깨비와 마법보다 과학이 신기한 마녀의 좌충우돌 동거 이야기!
시니컬 아포칼립스,좀비 사태와 두 사람의 이야기
미선,"미안해, 미선아.."
BL 오 나의 주인님,두고봐! 난 꼭 당신을 사로잡고 말테니까
내 주변의 공포 실화,내 주변에서 일어나는 공포 실화를 각색한 이야기
히어로 전우치,현대판 히어로 전우치의 이야기!
기견,기견 (SF/전쟁) - 지켜주고 싶은 소년과 곁에 있고 싶은 소녀의 이야기.
마녀의 이야기,마녀에 대한 이야기가 아닌 마녀의 이야기.
저주흉가,대학생들이 절대 들어가선 안 되는 곳 흉가에 들어선다.
Pantheon 판테온,자유길드 판테온에 들어간 주인공들의 성장스토리
계바의 스포트라이트,내 인생의 스포트라이트는 아직 오지 않았다! 35세 노처녀의 민낯 일상!
이세계 백과사전,앗! 이세계에 와버렸어! 악어야의 좌충우돌 이세계 모험기!
마왕과 용사,마왕과 용사=썸남 썸녀?
철의 소녀,도망자가 된 족장의 딸 살비아. 소녀는 추적자들과 맞서 평화를 되찾을 수 있을까?
신이 깃든 집,성주신이 지키는 오래 된 집에 살게 된 아연. 신과 인간은 잘 지낼 수 있을까?
오늘도 수고짱ちゃん,취업과 삶에 찌든 장아찌 같은 우리들. 오늘도 수고하는 우리들을 그린 4컷툰.
청춘만세,"젊은이들의 꿈과 희망, 열정, 그리고 사랑에 관한 이야기."
고구마,주인공 도비의 달콤하면서도 목막히는 고구마 이야기.
EPISODE,낯선이가 들려주는 영화같은 이야기.
타임라인,"지금 이 시간, 우리의 모습"
달지기의 밤,두 소녀의 세계를 파헤치는 이야기가 시작된다!
사회부적응자,세상과의 타협을 거부한 한 사회부적응자의 외침
뭔가 부적절한 그들,독수리 인간과 겁쟁이 강시의 일상 이야기
특별한 기념일,친한 친구에서 한 명의 남자로 다가온 첫사랑 김남길 박송희는 고백을 위한 기나긴 여정을 떠나려 한..
가식,"착하고 성실하며 모두의 모범이 되는 사람, 하지만 실상은 겉과 속이 다른 쓰레기. 그의 대한 가식.."
펭댕우곰이야기,조울증 불안장애 우곰과 우울증 말기(?) 환자인 펭댕의 정병종합세트 연애툰
오구오구 쭈쭈네,다큐멘탈로 살아가는 좌충우돌 가족이야기~
시답지 않게,"괜찮은 삶이 아니라도, 잘 살고 있는게 아니라도, 시답지 않게 살아가는 삶에 대한 이야기"
안녕 게으른,게으른의 게으른 일상
헤븐,^^
그림성경,누가복음과 사도행전부분은 책으로 만들어지게 되어 출판사의 요청에 의해 삭제 했습니다
개 같은 인생살이,개( 즐거울 개 : 愷 ) 같은 인생살이
떠올리다,몰락한 천재 선수 장지훈의 새로운 도전! 신생 야구부 상미고등학교의 성장기!
단돼의 인턴일기,인턴 중 괴롭고 즐거웠던 에피소드를 그립니다
화성에서 온 여자친구,"평범하지만 운 좋은 주인공, 한별하는 자기 지갑을 찾아준 동급생, 서예린을 사랑하게 된다. 하지.."
하룻강아지,자신이 호랑이인 줄 알고 살아가는 하룻강아지의 일상 매주 수요일 연재
브리즈,유성고등학교 야구부원의 성장 스토리
야미스쿨 야구에 미친것들,야구 팬들의 평범한 일상과 프로야구 리뷰를 재미있게 풀어 갈 예정입니다. 야구 좋아하시는 분들 즐..
미미와 펭삼이의 순탄한 일상,다섯 살 생일에 만난 우리! 순진하고 귀여운 소녀 미미와 범상치 않은 애완펭귄 펭삼이의 순탄한 4..
박하의 효능,같은 반 여자애의 비밀을 알아버렸다
잔혹한 요정들의 이야기,"모두가 요정의 저주에 걸린 세상, 한 대회에 참가하면서 알게되는 요정의 진실"
더 이상 숨기지 않기로 해,친구의 죽음 후 우연히 몇 달 전으로 가게 된 주인공 그리고...
마법사라도 연애할꺼야,마법사들은 서로 정해진 짝과 결혼해야하는 규칙이 있다..이 규칙을 어기는 한 소녀 마법사 이야기
빽가네가 떳다,평범한 4인가족의 평범하지 않은 일상의 이야기 시트콤
엘보,"붕괴된 2038년, 홀로 굳건히 서 있는 '네이션'. 한 사건을 계기로 비밀을 .."
버찌 다이어리,지극히 버찌주관! 파란만장 다이어리
주말의 게이머,정체를 알 수 없는 오이와 평범한 28살 여자의 게임 여행기
향기를 입다,"잘나가는훈남형강태하,방구석 히키코모리80년대 강설하.두형제사이에향기처럼스며든여자여솔. 세사람의 이.."
오늘의 일기,저의 일상을 빠르게 적고 그려냅니다
사랑타령 좋아해요,진부한 사랑 타령
딜구,최고의 용병을 꿈꾸는 용사 과연 허접고를 야구명문으로 만들 수 있을것인가?
판타스낵,하루도 가만히 있지 못하는 프랑크! 친구들에게 생각지도 못한 장난을 치면서 다이나믹한 일들이 벌어..
오늘도 쏘쏘,"프리랜서 딸쌍둥이맘의 육아,일상 이야기입니다."
마고령,사람이 죽어 원한을 품으면 '원혼'이 된다. 이 원혼은 시간이 지나면 요괴 혹은 악귀라는 존재가 ..
RUN 출판만화 버젼,팟캐스트 '모든 것이 예술이 된다'를 들으시는 분들을 위해 웹툰 버젼과 비교하여..
형 한 잔 쪽 빨어,"직장의 노예, 나를 열받게 하는 모든 것을 씹는다!"
설레이는 나날,샴고양이 '설이'와 집사 '태이'의 하루하루 설레는 반려일상!
오이의 자리,사람마다 무언가에 익숙해지고 무언가를 잘 다루게 될 때까지의 속도는 다르니까.
고볼트,고볼트코볼트
혼밥 혼술 혼자 사는 이야기,혼자 사는 일상 자취툰
돼콜바,비인기남의 슈퍼히어로물
쉬는시간 이야기,몇개의 단편들입니다.
60점 엄마,60점짜리 엄마의 고군분투 생활기
서유신마록,누구나 알고 있는 서유기. 하지만 무언가 이상하다. 요상한 삼장과 까불이 손오공의 모험이 시작된..
오늘의 헛소리 2,서른 어디쯤 쿨내짠내 직장인 인생
오늘도 널,엉뚱녀의 풋풋한 첫사랑 이야기
통순이의 콘티북,웹툰작가 지망생 통순이가 미리공개하는 콘티북 매번 새로운 캐릭터들의 릴레이옴니버스만화
큐빌리언,1995년 대한민국 초등학교에서 벌어진 기묘한 이야기
키드☆스타,산양 숲을 중심으로 둘러싼 능력자들의 이야기.
그림자 안내인,그림자를 안내하는 아이들의 이야기
천하제일 팔문당,고기를 먹기위해 무술대회에 출전하는 진 우의 이야기.
드림캐쳐,꿈의 여러가지 이야기를 들려드립니다. 기대해주세요**
헬로우 월드,답답한 건 딱 질색인 두 사람이 만나 겪는 무지개빛 일상&여행 기록
STAR X STAR,인류의 자연환경 파괴와 오염으로 마지막 삶의 터전마저 빼앗긴 동물들과 인류의 이야기
설원의 배달부,빙하기가 도래한 지구. 목숨을 걸고 화물을 배송하는 배달부들의 이야기.
더머 빌리,늙지않는 불멸의 소년 빌리. 소년의 비밀의 모험이 시작되는데 과연 시련들을 극복할 수 있을까
1023,은수와 그녀의 남자친구 시열. 그리고 그 사이에 끼어든 미스테리한 남자 우현. 그들의 사랑 이야기
3년째 신혼일기,매주 금요일 업로드
달빛 창가에서,.
단짠남녀,밥 못 먹는 남자와 밥 잘 먹는 여자의 달콤 짭짤한 이야기.
쾌변과 똥양의 24시법이야기,성범죄 사건들에 대해 일상생활에서 쉽게 파악할 수 있도록 설명한 교육 웹툰입니다.
다섯 숲의 푸와도,특별한 재능을 가진 다섯 인물의 여정을 다룬 판타지 작품입니다.
대타,"최악의 1급교도소. 가난한자가 대신 돈을받고 교도소에 들어가자, 대타를 거르러 여형사가 교도소에 .."
24,"신의 실수, 시간의 버그 틈새로 태어난 그들. 그들과 얽힌 비밀, 그리고 진실"
더 크라운스,액션 판타지
툰포엠,그림과 시
주간도시기담,공포의 탈을 쓴 개그 만화입니당
용왜공,용사는 왜?공주님을 구해야 하죠? / 추후 리메이크를 위해 잠시 내리겠습니다. 죄송합니다;D
4 cut toon,4컷. 1일1연재. 의식의 시각화. 어쩌면 당신의 이야기. 2014111794ha@google.c..
극한고딩,연애바보 배리의 하드코어 스쿨라이프.
쿠스,재앙신에 의해 종족을 잃어버리게 된 소년 쿠스가 재앙신에 대항하기 위해 모험하며 겪는 일상 이야기..
여덟 빛깔 무지개,"90년대 초반, 시골마을 장씨집안 이야기.(매주 수요일 저녁 연재)"
쾌변과똥양의 365일법이야기,일상생활에서 접할 수 있는 사건들에 대해 쉽게 법적으로 설명한 교육 웹툰입니다.
하차택배툰,웹툰 작가 지망생이 하차 알바 뛰는 이야기. (실제 2년 넘게 택배 하차 알바를 뛴 알바생입니다...
우리는 연애중,츤데레 여자와 내숭덩어리 남자와의 연애이야기 청춘들의 사랑이야기!
루나샵에 어서오세요,지구인 소녀 미샤의 마법용품가게 이야기
고양이 관찰일기,집사가 고양이을 키우면서 벌어지는 일상툰
시작,너와 나의 이야기
부비크루,자살을 원하는 애들이 살려고 미친짓도하고 발버둥치는 만화 부비크루(멍청이 동아리)
수학 잘하는 법,.
하얀나비,"외계인과의 전쟁 후 세기말 도시, 그리고 야망을 품은 소녀."
새대가리들,이것은 우리의 대학일기
사랑에도 유통기한이 있나요,"이별까지 남은 시간이 보이는 모태솔로 로맨스 작가, 자신의 골수팬 남돌과 드라마를 찍게 되다?!"
대통령과 나,평행 우주 속 대한민국에서 적폐들의 견제를 한몸에 받는 미남 대통령의 일상
구 신비의 나무,리메이크로 따로 만나겠습니다
한마디로,취직이 하고 싶어 우연히 들은 사람의 제의로 취직을 하게 되는데...
뺌툰,빼미의 일상 이야기
파독,.
찔레꽃 너머로,임진왜란 당시 일반 백성들과 일부 양반들의 갈등과 다양한 군상들의 욕망이 뒤셖인 한시대를 그림
나는 오늘 이렇게 살았다,당분간 휴재합니다.
이순신세가,1940년에 탈고된 이순신세가가 80여년 만에 웹툰으로 돌아옵니다!
셀프 낙서장,"멍하니 있으면 날아가버리는 생각들, 함께 나누고 싶은 생각들.... 모아모아 끄적끄적 낙서장 위에.."
test,test
Air,"붉은 눈을 조심하라는 어머니의 말,몇 달 뒤…붉은 눈의 여동생이 태어났다."
요깃거리 행성 요기월드,요깃거리 요괴들의 일상 판타지
캐나다에도 산다,같은 하늘아래 땅인데 뭐가 이렇게 어려운지.. 익숙한 듯 낯선 나라 캐나다에서 살아가는 여여커플 ..
