title,story
예삐와 싼초박,사귀는 하루하루 일기
불면버스,지구관찰일지 잠안올때 한번씩
퇴마전기,수련생인 유우는 어느날 생일을 맞이하여 할머니께서 선물로 퇴마사로 전직하게된다. 퇴마사의 조건은 ..
나 알아,전따 분장 작품이다.
아북곰,북극곰 팥슈와 친구들이 겪게 되는 환상적인 모험. 팥슈는 친구들과 무사히 집으로 돌아올 수 있을..
안녕,주인공 아름이가 예쁜 아이돌이 되어서 격는 이야기다
무쉬,"성격 밥말아 먹은 뱀파이어 와 반인반수 의 동거,"
쌍둥이야기,두 작가가 릴레이 형식으로 그리는 쌍둥이 시트콤 만화입니다.
Persona다정토크,다양한 정체성들의 토크
흑백의,계속되는 흑과 백의 대립 격주 일요일 연재.
생 활,공부와 게임의 굴레속의 힘겨운 생활
달팽이,어떤 초등학생들의 일상툰. 중간중간 판타지풍 상상툰도 있습니다!>-<
간식다방,옴니버스로 펼쳐지는 다양한 이야기와 간식들.
인 스펙트럼,지극히 평범했던 삶
늑대지얌,먹고 놀고 자는 것을 좋아하는 본능에만 충실한 살찐 늑대 늑대지입니다.
유자의 오늘,유자의 소소한 일상들
던전 패밀리,던전생활 다큐멘터리
UNEVEN,마력이 존재하는 세상에서의 혼혈소녀 이야기
썸씽,모태쏠로녀 한심이와 고지식남 왕세자의 이야기.
정상 컴플렉스,"산 정상에 있는 정상 아파트로 이사온 남매, 옥상에서 수상한 포장마차를 발견하는데...?! 평범.."
추리닝 앤 수면바지,편안한 일상물입니다
그남자 그여자,중년 부부가 가족들과 일상을 살아가면서 느끼는 희노애락을 그리고 있습니다.
천사의 눈물,세 소녀의 여행 이야기
황금 장미,"12대를 줄줄이 아들만 낳은 판티움 후작가, 10대를 줄줄이 딸만 낳은 해리지 백작가의 결합의 산.."
지그재그툰,우리들의 제데로된 일상입니다
아이러브Animal,귀엽고 사랑스러운 동물들.. 그리고 독자님들의 사연이 어우러진 귀여운 이야기 많은 관심 부탁드..
사랑 해봤니,알콩달콩 연애 이야기??!!?!?
괴생,괴물 생명체 와 벌이는 숨막히는 사투!!
최강검사 듀도,최강검사 듀도의 판타스틱한 모험이야기
홀랜즈 wholelands,올빈을 찾아 지구에 온 홀랜즈 이야기
흥안전,고구려의 태자 흥안과 백제여인 한주의 국경을 초월한 운명적 사랑이야기 ! 1500여년전 한반도에..
서창식의 라면 후기 만화,글로만 쓰는 후기는 질렸다! 그래서 직접 그렸다 본격 라면후기만화!
젤리곰이야기,귀여운 젤리곰이 커카는 이야기랍니다
이런 카페 처음이야,어느 날 갑자기 이상해진 카페와 얼결에 말려든 평범한(?) 알바생의 이야기
바른생활,학원 액션물 입니다
마녀수업,마녀수업
모태솔로 수용소,모태솔로가 중범죄자 취급받는 미래의 한국. 엉겁결에 잡혀들어온 독고남과 수감자들의 우여곡절 코..
길리,길리는 종종 살인충동을 느끼곤 한다.
반지위에 큰알,"남자를 뜯어먹는 된장녀가 있다. 그녀는 명품을 너무좋아하는 여자 다, 그런데 어느날 친구들 .."
그래도 괜찮아,29살 직장인의 소소한 일상 이야기 입니다!
야생의 사내들,암울했던 일제 시대를 배경으로 야생 동물과 인간의 갈등을 표현한 작품.
패시 앤 액티,"초, 중학교 동창인 우유부단 패시와 긍정 집착녀 액티의 연애 이야기"
빙하기사람들,슈퍼폭풍을 피해 마트로 모인 사람들. 그 안에서 만춘과 광식이 실수로 살인을 저지르며 벌어지는 이..
호구주위보,호구들을 위한 만화
악마도 의무교육 받습니다,천사에게 늘 패배! 지옥은 자리가 모자라 늘 위기상황! 대악마 사탄은 의무교육을 통한 엘리트 육성..
country road,집으로 돌아가는 길
오즈의 평범한 나날,오즈의 마법사. 오즈는 진짜 마법사였다?
고양이의중력,하루 한 번 먹는 고양이 알약
지상에 내리는 신,"신의 힘을 가진 소년 로웬, 세상 밖으로 첫걸음!"
유쾌빽양의 가족적응기,유쾌빽양의 사회적응기를 끝내고 가족적응기를 시작합니다! 신혼과 함께 육아전쟁에 뛰어는 빽양. 많이..
19금 외고손오반자살하는만화,오반가족의 한국 입시 잔혹사
새는새인데날지못하는쌈닭이라네,시골사는처자의 일상 이야기
온신일기,매일매일을 시트콤처럼! 직장인 일상 웹툰
마인크래프트 지옥의 천재,마인크래프트에서 지옥에갔는데 천재가 있다?! 사진으로 올립니다 ㅎ
마인크래프트 지옥의 천재,마인크래프트에서 지옥에갔는데 천재가 있다?! 사진으로 올립니다 ㅎ
축구를보자,잘 부탁드립니다_ _)
순결한 빛,세상 속 작은 자들의 이야기입니다.
신들의 전쟁,신들끼리 전쟁을 하는도중 한 여자아이가 나타난다 그 여자아이는 과연 누구일까?
유부녀의 탄생,"누구도 알려주지않은 결혼식 준비에 대한 리얼리티 카툰! 이 만화가 결혼을 생각하거나, 준비하고 계.."
알수없음,알수없는 사람들의 이야기
하루달콤 하루쌉싸름,잊지 못할 추억의 음식들. 그 안에 담긴 소중한 이야기.
실화와 허구의 이야기,저의 이야기 바탕으로 실화 또는 허구의 이야기로 진행하는 이야기 입니다.
전설의 용사 멍멍페라도,상상 속 캐릭터들이 살고있는 차원 '상상나라'. 어느날 '검은악마'들의 출현으로 상상나라는 온통 ..
고양이를 다루는 기술,가벼운 발걸음으로 돌아왔습니다.
백설녀와 나무꾼,항시 일곱의 남자를 관리하는 어장녀 백설! 만남의 시작은 좋으나 끝은 더러운 나무꾼! 기타 동..
여동생은 로봇,"어느 날, 여동생이 택배로 왔다! 뜨허!! 설마... 아빠가!? 다행이 친동생이 아니다. 그러나 .."
도톨이맨,도톨이의 코믹한 에피소드를 담아 만든 웸툰 입니다. 코믹한 도톨이의 일상을 기대하세요!!
쓰담쓰담 보통날,쓰담쓰담해주고푼 평범한 이야기를 하나씩 그려가요^^*
위험한연자씨,위험한연자씨의 하루하루의 소소한 일상이야기 입니다.
고고싱,32살 겨울 직장을 그만두었다. 행복과 성공을 꿈꾸는33살 백수가장의 새인생 프로젝트
공주시 심령관리국 신관동대,이승과 저승. 그리고 설화가 공존하는 세계. 그것을 관리하는 사람들의 이야기.
메리 제인,글. 11월 토끼 그림. 송이 현대판 말괄량이 길들이기
아이들의 역사,역사 수업시간에 일어난 아이들의 이야기 입니다. 아이들은 보면 좀 곤란할 것같습니다. 선생님이 이..
용네일,혼자서하는 네일아트 같이 공유해요^^
파리대왕,죽은자들 사이에서 살아야 하는 비정규직 퇴마사 창의 이야기
인생유사,인생이야기
망자카페,어린시절부터 남들이 보지 못하는 것을 볼 수 있는 능력으로 인해 왕따를 당해온 여고생 하나(17)..
속마음,누군가에게 말하기는 쑥쓰러운 속마음에 관한 이야기
내 생에 마지막 다이어트,2014 다이어트 프로젝트! 고도비만 김 회원의 생생한 다이어트 이야기~!
누 설,저승의 영혼을 부르는 '영매'들의 이야기
더 크래셔,"실험에 의해 무적이 된 소녀와 소년의 대치,"
핫바와딸기,핫바와 딸기의 시트콤같은 이야기
타루카나시아,모험과액션
그런 만화가가 있었다,그런 만화가가 있었다.
혐오스런 온조의 일상,저퀄리티 지향 일상툰(이라고 말하기도 수치스러움)/자유연재
늑대와 양아치,안알랴줌
아빠도 사춘기,아빠가 주인공인 만화 입니다.
모스키토,"수면기에서 갓 깨어난 뱀파이어인 나, 극심한 배고픔에 거리로 나섰으나 인간의 모습은 보이질 않는다.."
미드가르드 연대기,본격 메카닉 액션 서사시^^
나는 신이다,어느날 신의 갖게된 남자의 이야기.
가출을 부르는 하숙집,능력자와 동거를!
언제부터 시작된걸까,이 이야기는 사랑을 하는 어떤 남자의 이야기 입니다ㅎㅎ
기게스웹툰,"""웃기다"" 라는 것에 더하여 철학적인 부분도 자극해 보고 싶은게 최종 목표라고 할까요. 독자들의 .."
장사 안 해,"자고보니 막장 역하렘 소설에 들어와 있었다. 그것도 술집 여주인으로. ""장사 안 해. 꺼지라고.."
그림ㅁㅁ,ㅎㅎㅎㅎㅎㅎㅎㅎㅎㅎㅎㅎㅎㅎㅎㅎㅎㅎㅎㅎㅎ
내가 세상에 없으면,만약..내가 세상에 없다면 나는 편안해 질까? 왕따소녀로 활동하는 한 소녀의 이야기
격정의 로맨스부,누구나 상처 하나쯤은 가지고 있다. 상처의 크기만 다를뿐.. 상처로 삐뚤어진 17세 여태종의 로..
생각만큼,"미국에서 생활 8년, 초등학교부터 고등학교, 이젠 대학 입학을 앞둔 미대 준비생의 생활툰."
컴터로 그린 걍 그림,컴터그림판으로 그린 이상한 그림
남편이 미쳤어요,"남편의 취미는 마눌 괴롭히기, 특기는 마눌 괴롭히기입니다. 전격 남편 뒷담화 웹툰!"
이런 저런,●막장 코믹 웹툰●
워터헌터,물을 찾아서 싸우는 전사들의 이야기에욤.
안개가 짙은 날,감염자를 찾아라. 보통사람의 눈으로는 볼수없는 감염자. 하지만 감염자를 보는 특히한 눈을 가진 아..
헬게이트,"신부도,수녀도 아닌 한 여성 엑소시스트의 이야기"
죽음의 세상,한아이가 죽어서 죽음의 세상으로 가는 이야기
도찐개찐,커플인 도야지와 개자시기의 연애 일기입니다
동네 바보 아저씨,체면은 내려놓은 동네에서 유명한 바보 아저씨 이야기
천국 최전방 갸오오,천국에도 군대는 있습니다!
뜨겁던 여름날,1부 - 뜨겁던 여름날 같은 동급생인 여자애와 만났다. 무뚝뚝한 얼굴로 꽤나 귀엽게 구는 행동이 ..
일상만끽,행복은 발견하는 것! 언제나 별일 없이 사는 우리의 일상을 유쾌하게 꺼내본다. 매주 토요일 6..
골프스타,골프스타와 불리우던 월트와 그의 제자 천재 골퍼 데이빗의 진정한 골프 이야기
요망진그림공작소,소심한 회사원이 그려나가는 일생의 소소한 재미...
개성 중학교,개성 중학교에서 일어나는 개성있는 학생들의 이야기 자유연재입니다..
매일남매,이 이상한만화가 여기로 왔어
거북이난다,삼촌과 삼촌의딸(?)과 함께 살게 된 선호 그들과 주변인들의 황당유쾌한 성장이야기
저는 외국인이 아니에요,불쌍한 한 사람의 인생
Who am I,나는 누구인가요?
뽀따아저씨와 고양이,"우리동네 3대 바보중 하나인 뽀따아저씨와 특촬물 매니아 짬노인, 고양이덕후소녀 양덕이등 본격 트레.."
731,1939년 교토제국대학을 입학한 신이치는 이시이 시로 처럼 전장에서 일본군을 치료하는 의사가 되기..
스크큐볼,다음에 삼대마약이 되어주겠다!
연애고자,연애 못 하는 만화
dfdsfg,dsfgd
살사스캔들,살사를 접하면서 벌어지는 에피소드를 다룬 이야기. 살사를 접하는 모든이와 아닌 일반인들에게 살사..
Espérance,"자살하는 도시, 옥상에서 피아노를 치는 남자, 그리고 소녀"
포갓레인저,변신액션히어로
마요네즈,부드럽고 느끼한 마요네즈 같은 특이한 그와 그녀가 만나다.
홍이,고아였던홍이가 친할아버지와살아가는 이야기
그들만 모르는 비밀,산업통상자원부에서 근무중인 철수와 영희. 이 둘은 아무도 모르게 사랑을 키워가는 사내연애 커플이..
포레스트,판타지 세계로 빠져버린 주인공의 이야기
전설의레전드,여자들의 학교생활 전설의레전드
짐승의 맛,인간이 되고싶어 하는 냄새나는 물고기와 천재 조향사 이야기.
꽃보다 요지경,본격! 공감 인문학 웹툰!
캥거루댄스,호주 모험기.
소울,지옥을 탈출한 강력한 악령(가갈루안)이 세상을 지배하려 한다 이에 맞서는 술사(최진혁)과 그의 ..
희망가족꼬투리,아침 출근을 하며 한손에 들린 스마트폰과 s펜으로 그리는 40대 아버지가바라보는 가족 이야기! ..
달콤한계절,한 남자의 짧지만 오랜 사랑이야기
정신나간 뇨자들,정신나간 네 여자들의 정신나간 스토리
B1A4에 대한것들,비원에이포에 대한것들이나옵니다!!
아이돌TV,파워포인트로 만든 망작이지만 예쁘게 봐주세요
해시브라운의 카투사 이야기,카투사 출신의 예비역이 이야기하는 솔직한 카투사 생활 이야기
망령님의 대리만족,죽어서 영혼만이 남은 령. 기이한 영력의 힘을 가진 사람. 그리고 이들 사이의 이야기에 우연..
아첼레란도,"‘천재가 타고 나는 건, 할 수 있는 ‘재능’이 아니라, 하고자 하는 ‘욕구’이다. 따라서 타고난.."
모그리나,"별난가족, 별난룸메이트, 별난남자친구. 미국생활 10년째 여자사람 이야기!"
키로,전설의도깨비방망이 제페토 를 찾아 대마왕 제아브로부터 세상의 평화를 지키기위한 키로의 모험이 시..
내 마음을 너에게,두근두근
코니 명언,일상에 지친 당신의 마음을 달래 줄 위인들의 따뜻한 명언으로 삶의 에너지를 충전하세요 !
i am ssem,안녕하세요. ^^ 처음 올려보니다. 국보급 컴맹이라 많이 힘들었습니다. ..
이온,.
흔한사랑이야기,"그들은 흔하지 않지만, 그들이 하는 사랑은 흔한 사랑 일 뿐."
비타민 H,일상이 뒤집혀 내가 나의 것이 아니게 된다. 가장 필요한 한가지를 뺏긴 이야기 비타민H
검은알,"공해수,드디어 검은 알의 기운으로 .."
별똥별,별똥별떨어지는날 소원을빌었더니 나타난 구미호형제와 전생부터 몸이약해 일년안에 죽는 불치병을가진 소..
일탈,이 곳은 너무나 갑갑해. 내가 나로 있을 수 있는 곳은 어디지.
라이브 칠드런,"마법학원 루이리즈 학원에서 일어나는 라이브칠드런 그들의 비미로가 조금 특별한 생활, 그들의 이야기.."
검은나비,평생 함께 하지만 잘 모르는 것에 대한 이야기 입니다.
마녀 전설,마녀와 계약으로 마녀의 손에 자란 비올라. 자신의 부모를 찾아 마녀와 무슨 이유로 계약을 했는..
못배운 자들의 슬픔,무식의 향연. 그리고 무식의 최후.
성폭력에 대한 오해와 진실,데이트성폭력에 대한 오해와 진실! 성폭력 예방 만화입니다. 많이 봐주세요!
모이 삐 빠이,10박 12일 첫 해외봉사 리얼스토리
Gzar,쿠키가게에 모인 좀비들의 소소한 쿠키를 만드는 일상입니다~
천사라네,초급천사라네. 천계에서..그리고 인간계에서 진정한 천사로서 성장한다.
오마걸,미국에서의 일상을 담은 이야기.
Full Metal Wing,드래곤 라이더 이야기. 1~2주 간격으로 주말에 올립니다.
Circle Of Life,나의 발걸음은 나 자신의 발자국을 향해 걸음으로써 진정한 자신의 자아를 만나게 된다.
상감탈출,퐌타지액션로맨스어드벤쳐대하사극....은 아니고 . . 그냥 병맛궁궐시트콤-_-
중딩생활,작가가 중학교 생활 3년 동안 겪었던 재밌는 에피소드
Option,여러가지 선택의 최후는
섬데이 선샤인,"행복해지기를 바라는 평범한 회사원 쨍쨍이의 하루하루를 감성적이게, 때로는 코믹하게 풀어냈습니다."
심심부르스,심심하게 생긴 그녀의 심심한 일상 이야기
하하하,병맛 코믹 스 릴러
비건,"동물이 사람잡는만화 새로운 인류의 탄생으로 , 지구에게 버림받은 인류의 생존고민만화"
아빠와 함께 춤을,홍콩 사는 아빠와 좌충우돌 육아일기
참 잘했어요,"천재 교사 김준성, 다시 고등학생이 되다? 고등학교 교사가 고등학교에 잠복해 고등학생 연기를 하며.."
로맨서,알리샤와 이언의 마법 여행기
섬의 지배자,표류당한 주인공. 이상한 섬에 도착하게 되는데..
숨은 고양이 찾기,쉬운 이야기를 어렵게 하는 이야기입니다.
트웰브,시간에너지를 지배하는 자가 세상을 지배한다!!
신입사원 김용사씨,소녀와 용사는 서로 힘을 합해 마왕을 무찌른다.8년이 지나고 현실로 돌아온 둘은 결혼을 하지만 용..
쉼없이 시간을 거슬러 너에게,"시골에서 도시의 큰 고등학교로 진학해 혼자 살게된 주인공, 그 곳에서 자신과 둘 뿐인 가족 아빠 .."
우리누나는 안되는데요,우리누나 데려가는 사람이 불쌍하거든여
Art of loving,일상에서 일어나는 소소한 사랑이야기
레알,백반집 반찬처럼 매일 달라지는 만화가 도파민 양을 증가시켜 세로토닌을 활성화 시킨다.
딩동구리,딩동구리
유쾌한 친구들,나라의 영웅 'CH'. 그들이 세운 의뢰해결단. 그리고 그 해결단의 비밀 단체.
용아의 글림 단편 만화,"단편 만화집 입니다. 모토는 ""가볍게, 그러나 아주 가볍지는 말고 좀 가벼운 듯만하게""입니다."
테리어스,판타~지한 만화에여
고스트 메모리즈,유령처럼 되살아난 잊혀진 기억들. 인류의 평화를 위해 그들을 사냥하는 기억사냥꾼들의 이야기.
저승사자,어느 한 저승사자와 소녀의 죽음에 관한 운명의 이야기
Teo,"테오와 친구들은 거대한 힘 앞에서 어떤 선택을 내릴 것인가... 힘에 굴복할 것인가, 이겨낼 것.."
사일런트 러브,복수를 하려고 해.
여우비,비가내리는 중에..
악어떼가 나온다,한국토종악어 엘리와 잔소리 사랑꾼 악어새 럭키의 미국정착기:)
비밀동화,노후군이 들려주는 동화의 뒷이야기 커피의 에스프레소처럼 쓰고 리스트레또처럼 달콤 살벌 한이야기...
우울과 몽상,10화 내외의 단편들로 구성되는 단편웹툰집입니다. 다소 잔인할수 있으니 15세 이상 읽어주시길 ..
그날의 이야기,2003년 2월 18일... 사람들에게 잊혀져가는 대구 지하철 참사... 그날의 이야기
숲속마을 친구들,요정과 인간들의 노는이야기
저주라는 이름의 축복,한 소년의 이야기
어반체이스,가족과 인생을 잃어버린 아이들의 복수심과 함께 벌어지는 추격전
그녀가매력적인이유,그녀가매력적인이유는?!?! 알아보자!!! 그녀의정체는...
못난 오리,동화 미운 오리 새끼처럼 불행하게 살아온 한 여고생. 여러 만남으로 백조로 다시 새롭게 태어나려는..
결혼의 낭만을 구해줘,"더 사랑하기 위해 결혼했으니, 이제 우리의 결혼에서 낭만을 되찾겠어!"
달밤만찬,푸른 여우 연이 꾸려가는 행복을 찾느 사람들을 위한 작은 식당
더스피릿,신의 능력을 부여받은 '더스피릿(THE SPIRIT)'과 판도라상자에서 나온 악(惡)을 토대로 만..
하늘 정원,최성훈과 김아름의 이야기
윌은 멍청해,윌은 멍청해
룬루난라,설명이 필요없다눈
이프,"기억의 톱니바퀴. 그 중 하나만 옮겨 놓으면 된다. 아무것도 변하지 않지만, 모든것을 변하게 만드.."
소녀 소녀와 연애하다,소녀와 소녀가연애를하는얘기
기막힌대결,동물의 왕국이나 디스커버리에선 볼 수 없었던 기막힌 대결이 펼쳐진다. (패러디 주의!!)
야상곡,"뱀파이어를 믿는 사람들, 그리고 종적을 감추는 사람들. 지우는 어느 날 나타난 정체모를 사람을 주.."
잘자요,고민이 많아서 잠 못드는 당신을 위해 Coco Devil과 마리가 함께합니다. 잘자요 :)
1회,ㅇㅅㅎㅇㄹ
령령령,특별한 영혼을 가진 사람들의 이야기...
제국의 아이들,이 작품은 제국의 아이돌에 대한 이야기입니다.
부처핸접,'초원'이라는 골동품 가게를 운영하는 남자주인공 독고주원 그 앞에 스스로 부처라고 말하는 남자가 ..
그냥 걷기,2009 디씨인사이드 국내 여행 갤러리에 연재되어 힛갤까지 갔던 ㅇㅇ님의 '그냥 걷기'입니다.
파산히어로,20년전 절대악이라 불리웠던 절망왕...을 막았으나 그로부터 20년 후 그들은 지속된 평화로 인해..
스펠 SPELL,순진무구한 허당무녀와 평범한 사람으로 살고픈 요괴. 그리고 초자연적인 대상들과 직면한 보통의 인..
창세기,"기존에 알고있던 천지창조 와는 근본부터 다른, 새로이 쓰여지는 창세기"
구죠의 교사라이프,학교에서 벌어지는 소소한 이야기들과 생각들을 만화로 옮겨봤습니다.
막나가는 캠퍼쑤,캠퍼스라이프~일상과 폭로!
GL소녀를 위한 사랑,슬프고 짜릿한 백합물
류민 우화,"동화 같은 만화 우화의 재해석, 감동의 애니멀즘 우화의 새 패러다임"
의자에 앉은 스미스씨,지상최강의 무기가 한 노인의 손에 들어왔다. 그의 이름은 대장장이 스미스!
RESET,윤택한 삶으로 인생을 뒤바꾸기 위해 인생 RESET을 한 평범한 직장인의 이야기.
자작 스폰지밥,이것은스폰지밥이웃기는코믹입니다.
인공도시,자유연재입니다
ㅇㅇㅈ,ㅂㅇ
납의 시간,악마의 성경이 발견된후 벌어지는 지상과 천상 그리고 지옥과의 처절한 사투.
니가뭔데,한여자와두남자! 삼각관계인이들의관계는.....
백만장자,만원으로 십억 만들기.
Devil,데빌&엔젤&사이다&콜라 그들의 궁합은??!
Apocrypha,타락한 악마 제퍼를 저지하기위해 천사에게 선택받은 둘로스의 전사 빅맨이 나타났다!!
K,"우주의신 'GK'가 여러 종족을 만들었는데, H(인간),K(능력자),GRK(신의 아들),그리고 .."
D,.
침니 스튜디오,"선생님은 베이스, 동철은 기타. (현재)2인조로 구성된 밴드 노벰버 침니(November Chi.."
365 곱하기 3,"일공씨디(버나, 에블, 도화지)의 일상 다이어리 겸 릴레이식 웹툰입니다."
스파이키 리스키,해외에서 살고 있는 작가가족의 일상툰 주2회 연재
파파실링기,사랑에 아파하는 남자와 사랑을 겁내하는 여자의 우연한 사랑이야기
종말의 날,세계는 종말의 날을 선포했다. 시한부 세계 위에서 살아가는 엉성한 남매이야기.
서울대의 나라 그후,한국인들은 왜 공부때문에 자살을 할까? 외국인들에게 소개하는 한국교육.
곰쪼마놀 부부일기,2년차 맞벌의 부부의 일상 생활
어느날잠에서깨어보니베이글녀가,'어느 날 잠에서 깨어보니 베이글녀가 되어 있었다' 하루아침에 여자가 된 26세 독신남 이야..
하루몽,"꿈을 꾸는 사람들, 그리고 현실을 살아가는 사람들의 이야기"
너만 모르는 이야기,귀신을 볼 수 있는 주인공에게 여자귀신이 보이게 된다. 그리고 황당한 부탁을 받게 되는데...'-..
Bike messenger,좀비 바이러스로 멸망한 세상. 하지만 이기적일정도로 영리한 국민들이 모여사는 동방의 작은 나..
나만 모르는 이야기,혼자인 사람들의 이야기
☞누가 진짜야☜,똑같이생긴 남자두마리가 덤비네
Sun and Moon,무림 일류고수 오누이의 모험이야기
마로이야기,말하는 개 마로와 평범한 여대생 순지의 이야기
디바인 안드로메다,갑자기 떨어진 낯선 세상에서 경험하게 된 것들.
자본위에존재하는것,"어렴풋이 ""자본주의 쩔어""라고 느끼고있었는데.. 계속 붙잡고 고민해야할 문제라고 생각해서 시작합.."
맨즈헤어뷰티쌀롱,남자 컷뜨 스왈로펌 다운펌
멜랑콜리아,나나나의 졸업 사진 찍는 날
Enough,일면식도 없는 오빠의 여자친구와 같이 살게 되었다.......
우리아이가 질문을 시작했어요,귀 쫑긋 공감 팍팍 생활육아툰 아이에게 사소한 질문이란 없다! 우리 아이 호기심 천재로 키우는..
APT,APT(A름다움이 P어나는 Ter전) 클레이를 이용한 우리에 일상을 담은 옴니버스 형식의 작품..
꼬매,기억을 잃은 인형 꼬매와 그의 친구들이 만들어 나가는 이야기!
BCD 코드,누구에게나 BCD코드가 있다. 우리는 각자의 삶을 BCD코드안에서 풀어가고 있다.
바람과함께 춤을,.
지구가 멸망한뒤,지구가 멸망하고 나는 살아남았다.
자정에서 동틀무렵,일상의 소소한 감성토막입니다.
아인슈타인,매주 토요일에 올라옵니다. 다른 사이트에서 찾으실때는 아인+슈타인이라 치시면 됩니다.
드림워크,청춘남녀들에 각자만에 꿈을 향해 노력하는 이야기 그리고 남녀간에 싹트는 사랑이야기를 그린 로맨틱..
레퀴엠,황금연휴를 앞둔 어느 날. 낯설게 변해버린 세상이 눈 앞에 펼쳐진다.
그의 조각들,좋은 의미에서건 나쁜 의미에서건 매우 독특한 삶의 방식을 선택한 남자의 이야기
청순한 자취방,20대 여자 둘의 병신미와 순수미가 넘치는 자취 생활! 흔하고도 흔하지 않은 우리의 이야기.
흑해의 성,흑해黑海에는 성城이 있다.
아알머ㅣ로히ㅏ몰ㅇㅁㄴ,하핳하하하핳하하ㅏㅎㅎ
