title,story
은밀한 재택근무,"평범한 회사원인 '한다연'. 
회사의 사활이 걸린 프로젝트를 성사시키기 위해,
벤처 기업의 대표이자 동창 '이지안'의 요구대로 그의 비서가 된다.
고등학교 시절 첫 키스를 망친 그 녀석과 재택 근무라니!
하지만 다연은 자신이 지안의 첫사랑이었다는 사실을 알게 되고,
지안이 마음을 숨기지 않으면서, 두 사람은 점점 가까워지는데..."
원포인트,"“내가 빛나지 않아도 좋아, 경기에서 이긴 후 우리 팀을 주인공으로 만든다.”

고등학교 입학과 동시에 마주한 배구부의 모습에 실망한 ‘이재혁’, “이런 게, 배구부라고..?”
재혁은 어릴 적부터 함께 해온 ‘도민환’, 배구부의 악행에 질려버린 ‘김단우’와 함께 직접 팀을 꾸리기로 결심한다.
개성 넘치는 팀원들이 한 명씩 모이기 시작하고 서로 다른 친구들이 모여
하나의 목표를 향해 달려간다. 목표는 최정상!!"
말숙이를 부탁해,"1년 전 부모님을 여의고 어린 여동생 말숙이와 단둘이 살아가고 있는 나에게는 남들에게 말 못할 비밀이 하나 있다.
그건 바로... 내 여동생 말숙이가 마왕이라는 것...!!! 게다가 장래희망은 지구멸망??!
그치만 마왕이면 뭐 어때, 누가 뭐래도 말숙이는 내가 올바르게 키울거야!!"
뷰티풀 군바리,'여자도 군대에 간다면?'본격 여자도 군대 가는 만화!
신의 탑,"자신의 모든 것이었던 소녀를 쫓아 탑에 들어온 소년
그리고 그런 소년을 시험하는 탑"
퀘스트지상주의,"[외모지상주의], [싸움독학], [인생존망]과 세계관을 공유하는 작품!
공부, 싸움, 외모.
뭐 하나 잘난 것 없는 평범한 고등학생 ‘김수현’의 눈앞에 갑자기 퀘스트창이 나타났다!
첫 번째 퀘스트, [엄마한테 사과하기]를 완료한 수현은 보상으로 키가 3cm 커지게 되는데!
퀘스트 엄청 쉽잖아?! 어떤 퀘스트든 완료해주마! 그런데 다음 퀘스트가?
[system] 학교 일진녀와 키스하십시오"
신화급 귀속 아이템을 손에 넣었다,"D급 무투계 레이더로 마법계 레이더들의 고기방패나 하며 별 볼 일 없이 살던 재현. 
그러던 어느 날, 던전에서 우연히 ""오딘의 눈"" 이라는 최강의 귀속 아이템을 얻게 됐다.
신의 눈을 가진 자, 세계를 구할 신의 대적자의 운명을 개척하라!"
장씨세가 호위무사,"‘당신이 부른 것이오. 나란 사람을... ’
은둔고수 광휘. 호위무사 되다.
웹소설 원작 웰메이드 무협 시대극!"
윈드브레이커,"혼자서 자전거를 즐겨타던 모범생 조자현.
원치 않게 자전거 크루의 일에 자꾸 휘말리게 되는데...
자유를 꿈꾸는 청춘들의 스트릿라이딩 드라마!"
소녀의 세계,"완벽해 보이지만 사실 외로웠던 백조들과 맘씨 착한 오리가 만나
여러 갈등을 함께 겪으며 진짜 친구가 되어가는 소녀들의 찐 우정물"
똑 닮은 딸,"'우리 엄마가 살인마인 것 같다.' 
성적 우수, 품행 단정, 모범적인 자식인 길소명은 엄마가 요구하는 기준에 맞춰 완벽한 딸로 살아왔다.
그러나 남동생이 강물에서 시체로 떠오른 그 날, 소명의 머릿속엔 섬뜩한 의혹이 피어오른다.
자식의 인생에 방해되는 모든 것을 없애려는 엄마와 그녀에게서 벗어나려는 딸, 두 사람의 잔혹한 모녀 스릴러!
2020 지상최대공모전 2기 우수상 수상작."
2023 요즘연애 특),"‘썸은 SNS로, 연애는 가볍게, 전애인과는 친구처럼’
요즘 연애는 이렇게 한다고?ㅋㅋ 진짜? ㅋㅋ
담당자의 말) 설렘가득한 봄날.. 이번에도 웹툰으로 대리만족하겠습니다. ^^"
버림받은 왕녀의 은밀한 침실,"한때는 추앙받았지만 지금은 비참하게 버림받은 왕녀 르웰린. 아무도 보호해 주지 않는 그녀에게 추악한 저주가 내려진다. 
그것은 바로 남자를 욕망하게 되는 저주. 
르웰린은 저주의 폭주를 막기 위해 결국 자신의 침실을 열게 되는데... 
버림받은 왕녀와 얽히고 설키는 네명의 남자들. 
저주의 진실은 밝혀질 것인가? 그리고 그녀와 함께 할 사내는 과연 누가 될 것인가?"
별난식당,"<요리GO>의 새로운 이야기,<별난식당>.
특급호텔에서 최연소 팀장에 오르며 승승장구하던 주인공 한별은 퇴사를 하고 작은 식당을 차린다.
그 식당의 이름은 '별난식당'.

별난식당은 상권이라고는 찾아볼 수 없는, 서울에서 제일 가난한 동네인 부자동에 위치해 있다.
또한 메뉴도 별나다. 바로 메뉴가 없기 때문이다. 메뉴가 없이 한별 셰프가 그때그때 제철 식재료를 이용해 요리를 만드는 식당이다.

이 식당의 특별한 점은 요리를 먹는 손님이 마음까지 위로 받는다는 것.
한별 셰프는 대체 어떠한 방법으로 마음의 상처가 있는 많은 손님들을 요리로 치유하는 것일까?"
앵무살수,"평범한 뱃사공으로 살고 있는 노소하. 
하지만 그의 정체는 전설적인 구파검법의 후계자다. 
이제 진시황이 남긴 비서 선근경을 향한 살수행이 시작된다."
만렙돌파,"알 수 없는 오류로 3000년간 각성 테스트에 갇힌 김기봉.
그 사이 현실에선 10년이 흘렀고, 온 세상은 몬스터와 던전으로 가득차게 되었다. 
만렙으로 귀환한 김기봉의 모든 것을 원래대로 돌려놓기 위한 싸움이 시작된다!"
백수세끼,"백수 시절 내 곁을 지켜줬던 그녀... 돌아와 주면 안 되겠니?
음식 메뉴마다 담겨 있는 우리들의 연애 흑역사!"
퍼니게임,"<머니게임>,<파이게임> 에서 실패를 맛본 주인공은, 마지막 <퍼니게임>에서
우승하기 위해 신체를 단련하고 정신을 다잡는다. 모든 참가자 중 본인만이
유일한 게임 경험자임을 확인한 주인공은, 승리를 위해 악마가 되기로 결심한다."
호랑신랑뎐,"산 속에 사는 금슬 좋은 부부! 그러나 이 부부에겐 어딘가 특별한 점이 있다.
 그건 바로.. 신랑이 사람처럼 걸어다니고 말도 할 수 있는 호랑이라는데..? 
무뚝뚝하지만 마음씨 착한 호랑이 신랑과 장난스럽고 수다스러운 인간 아내가 만나 벌어지는 좌충우돌 일상 이야기!"
잔불의 기사,"유일한 가족이자, 최고의 기사 유망주였던 쌍둥이 동생이 살해당했다.
천재적이었던 동생과는 달리 무예에 재능이 전혀 없지만,
동생의 복수를 위해 '강함'을 연기하기로 결심했다.
약해빠진 나는 복수에 성공할 수 있을까."
꼬리잡기,"건물붕괴 사고로 매몰된 9명의 대학생.
2주 뒤, 3명은 사망하고 1명은 의식불명인 상태로 발견된다.
가까스로 구조된 생존자 5명은 그곳에서 있었던 일을 숨기려 하는데... 생존자인 척 숨어있던 살인자에 대한 정황이 드러나기 시작한다.
수사팀은 이 밀실살인 사건의 처음과 끝을 파헤치게 된다."
나 없는 단톡방,"여고생 안효인은 학교에서 친구들과 잘 지내는 편이었다. 학급 내에서는 분위기 파악도 할 줄 알고 때에 따라 친구들을 적당히 웃기기도 했다. 
덕분에 그녀를 적대적으로 대하는 친구들은 거의 없었다. 그러나 어느 날 부터 효인은 영문도 모른 채 묘한 따돌림을 당하기 시작한다. 
스마트 폰을 뒤늦게 산 탓 때문일까. 심지어 효인만 없는 단톡방의 존재까지 알게 된다. 

""내가... 뭘... 잘못한 거지?"""
"순정말고 순종
휴재","하루에 무려 쓰리잡. 
스물 다섯 지언의 일과 끝에 남는 건 갑질에 시달린 스트레스와 돼지우리같은 집구석 뿐이다. 
그러다 어느날 얻게 된 인형 한 개. 이것만 있으면 대한민국의 탑 배우 남도윤을 가정부로 부려먹을 수있다...?!
2017 최강자전 대상 수상작 <늑대와 빨간모자> 슈안 작가의 차기작!"
히어로메이커,왕은 영웅이 되고 싶어하는 공주의 소원을 들어주기로 전격 결심! 공주를 속이고 마치 영웅이 된 것처럼 만들기 위해 온 나라가 연극을 하게 되는데..파란만장한 그들만의 눈물겨운 영웅만들기의 대장정이 펼쳐집니다~
북부 공작님을 유혹하겠습니다,"“내 애인인 척 사교계에 들어가.”
전 세계에서 주목하는 톱스타, 셀리나는
촬영 중 갑작스러운 사고로 북부 공작의 땅에 차원 이동한다.
마수에게서 목숨을 구해준 북부 공작, 칼시온은
셀리나에게 자신의 애인인 척 사교계에 들어가
정보를 입수하라는 계약을 제시하는데.."
물어보는 사이,"뱀파이어에게 물리면 건강해진다?!
두통으로 의도치 않게 비호감 연예인이 된 이채이.
우연히 톱스타인 서이준이 뱀파이어이고, 그에게 물리면 한동안 건강해진다는 걸 알게 된다.
물어달라 부탁하는 채이에게 이준은 계약 연애를 제안하는데..."
포스트 팬데믹,"어느 날, 한국대학교병원으로 실려 왔던 아르스24 변종 의심 환자가 탈출했다.
자신이 담당하고 있던 환자를 놓친 것에 대해 책임감을 느낀 감염내과 교수 정유현은 환자를 수색하는 일에 발 벗고 나서기로 하며, 환자가 마지막으로 목격된 화성시 수락 마을로 향한다. 그리고 그들은 마을 입구에서 무언가와 맞딱뜨리게 되는데...,
2m에 달하는 키, 일반 성인 남성보다 훨씬 거대한 체구, 손에 들린 동물의 시체, 피로 얼룩지고 찢어진 옷, 노인의 얼굴을 하고 있지만 노인으로 보기 힘든 남자의 모습.
수색조는 남자의 모습에 순간 압도당하고 만다. 그리고 정유현은 남자의 기이한 모습과 도망친 환자가 병원에서 보여 줬던 이상 증세가 서로 연관성이 있음을 발견하게 되는데..."
천재 타자가 강속구를 숨김,"부와 명예, 모든 걸 얻은 천재 메이저리거 강건우.
그런 그조차도 아내와의 행복한 결혼 생활만큼은 이어갈 수 없었다.
아내의 빈자리를 느끼며 후회하던 그가 신비한 반지의 힘으로 과거에 돌아왔다.
풋풋한 연애시절의 고등학생이 된 그는 이번에야말로 사랑을 쟁취할 수 있을까."
수영만화일기,"백수 겸 만화가지망생 해오, 저질체력에서 벗어나기 위해 수영에 도전!
작심삼일이리라는 예상과는 다르게 어느새 수영에 익숙해진다.
'이게 대체 어떻게 된 일이야? 나…… 수영을 사랑하게 된 걸까?'
그렇게 수영을 익혀가면서 점차 몸도 마음도 성장해나가는데…….
불확실한 미래를 안고 살아가지만, 해오는 오늘도 수영한다."
신군,"악마에게 모든 걸 잃고 먹이로 사육당하는 소년.
이를 갈며 복수를 갈망하지만 인간의 힘은 악마에게 닿지 못했다.
그때 그의 앞에 신군이 나타난다.
2020 지상최대공모전 2기 장려상 수상작!"
루루라라 우리네 인생,"시간이 지나면 자연스레 성숙한 으른(?)이 되어 있을 줄 알았는데
그저 술과 음란한 이야기를 좋아하는 알딸딸한 어른이 되어버렸다. 
 
어느날 귀농을 결심한 부모님을 따라 
어쩌다보니 시골과 도시를 오가게 된 현이씨의 인생 제 2막 시작!"
이별 후 사내 결혼,"대기업 K&C 공식 사내 커플인 다원과 태현, 
결혼까지 탄탄대로일 것 같았지만 태현의 바람으로 헤어지고 
그 상대가 태현과 같은 부서의 신입사원 유정이라는 것을 알고 충격에 빠진 다원

그런 그녀를 오래전부터 바라보고 있었다는 남자가 나타났다! 
근데 그 남자가 K&C 만인의 이상형, 제 팀장님이라고요?!"
더블클릭,"악명 높은 난이도를 가진 게임의 세계 랭킹 1위였던 지호.
서비스 종료된 줄만 알았던 그 게임이 새롭게 돌아왔다!
지호는 다시 한번 랭킹 1위를 꿈꾸며 게임 동아리에 입부한다.
오랜만에 게임을 해도 살아있는 감각. 하지만 게임이 새롭게 변하면서 예상치 못한 약점이 생긴다.
강한 상대를 마주할수록 열정이 끓어오르는 주인공의 프로게이머 도전기!"
결혼생활 그림일기,"고르고 골라 결혼했더니 매일매일 우당탕탕?!
결혼생활이란 무엇인가?
조용할 날 없는 결혼생활을 날 것 그대로 그렸다.
모자르고 부족했던 두 짐승이 만나 그려가는 결혼생활 그림일기!"
"또다시, 계약 부부","서로에게 강한 이끌림을 느꼈던 건하와 서연, 
하지만 전혀 다른 삶을 살아왔던 두 남녀는 짧은 결혼 생활을 마치고 결국 이혼을 선택한다. 
5년 뒤, 건하는 서연에게 또 한 번 '계약 부부'를 제안한다. 
""나와 다시 부부가 되어줘야겠어. 이번엔 꽤 사이좋은 부부로 말이야."""
악취해결사,"""이 지긋지긋한 마스크...!!""
태어나서 한 번도 마스크를 벗은 모습으로 나가본 적 없는 김무명.
사람들의 부정적인 감정이 내뿜는 악취를 맡을 수도, 볼 수도 있는 무명이 가장 뒤가 구리다는 소문의 명문 고등학교에 진학하게 된다.
끊임없이 마주하는 악취들과 사건들 사이에서 무명은 앞으로 이 학교에서 잘 버틸 수 있을까?"
랭커,"극비리로 진행되는 멤버쉽 온라인 게임 <랭커>.

우연히 랭커에 뛰어든 격투기선수 강준서.
어느 순간부터 상대가 괴물로 보였던 준서는 자신의 플레이어인 정준의 목소리를 통해서 안정을 되찾고,
정준과 함께하면서 증세를 치료하고자 마음먹는다.

하지만 랭커에는 목숨을 걸어야 하는 퀘스트뿐 아니라,
캐릭터끼리 벌이는 배틀과 사냥의 위협까지 도사리고 있다."
"아, 쫌 참으세요 영주님!","작고 가난한 영지 ‘화이트’의 영주, 로즈.
영주민들과 오순도순 잘 먹고 잘살고 싶었는데, 갑자기 이종족 이주민이 늘고 자꾸 사건에 휘말린다?! 
막강 능력 영주님 ‘로즈’와 그녀를 영지에 몰래몰래 숨겨 놓고 보호하고픈 스승, ‘대마법사 이그드라실’의 유쾌 발랄 로맨스 판타지!"
고백어택,"하나는 언제나 2등이었다. 늘 1등을 하는 한건우 때문에!
속을 알 수 없는 건우를 무너뜨리기 위해 수단과 방법을 가리지 않던 하나.
이번에는 가짜 고백으로 멘탈을 흔들려 했는데...
어라, 얘 이 고백 왜 받지? 뭐... 내가 좋다고?!"
리턴 투 플레이어,"어느 날, 게임이 되어버린 세상.
갑자기 나타난 몬스터들이 사람들을 죽이고, 사람들은 플레이어가 되어 퀘스트를 달성해야 한다!
인류의 종말에서 회귀한 2회차 플레이어, 김세한.
그는 과연 세상을 이렇게 만든 '시스템'을 쳐부술 수 있을까!"
파운더,"1970년대 각하에 대한 과잉 충성으로 비밀스런 공작대가 운영되었고 이는 정권이 바뀐 1980년대 대한민국 최초의 살인 청부 회사가 설립되는 토대가 된다.
공작대의 에이스 공작원은 처절하게 살아남아 살인청부업 회사의 대표가 되어 회사를 이끌어가게 되는데..."
오빠집이 비어서,"새엄마와 맞장 뜨고 집을 나온 재벌 3세 차은명.
세상 딱 한 명인 친구 희영에게 신세를 질 수 없게 되자, 
어쩔 수 없이 희영의 둘째 오빠가 잠시 비워둔 집에 머물게 된다.

그렇게 한 달 뒤, 은명은 샤워를 하고 나오던 중 
예고도 없이 집으로 돌아온 희영의 둘째 오빠를 대면하게 되고... 
그런데 그 오빠의 정체가 바로바로 대한민국 탑 스타 영화배우 ‘제준영'이라고?!"
미니어처 생활백서,"모르는 할머니가 준 젤리빈을 먹고 작아져버렸다?!
소꿉친구 방에 있는 인형의 집에서 지내게 된 18살 남고생의 눈물겨운 생활기!"
꿈의 기업,문명을 지배하는 거대기업과 거대기업을 움직이는 인공지능. 그 인공지능이 꿈을 꾸기 시작했다. 엄청난 경쟁률을 뚫고 대기업 드림코퍼레이션에 입사한 꿈사원들. 그들 앞에 의심스러운 일들이 펼쳐지는데..!
사이다걸,"어느새 세상은 고구마밭이 되었다.
앞뒤 꽉꽉 막힌 사람, 대화가 통하지 않는 사람, 상식이 통하지 않는 사람이 넘쳐나는 세상…
상처 주기 싫어 참고, 배려하는 사람이 오히려 바보 취급당하는, 무언가 단단히 잘못된 이 세상!
착할 사람일수록 할 말은 하고 살 수 있는 세상을 위해, 청량감 넘치는 히어로 ‘사이다걸’이 신비한 사이다를 들고 찾아온다."
서브 남주가 파업하면 생기는 일,"평범한 한국인 ‘정예서’, 동생이 읽고 있던 대한민국을 휩쓴 
초메가히트 로맨스 판타지 소설 ‘퇴사했더니 이계 공녀’에 서브남주로 빙의한다.
이 서브남주, 훗날 전쟁에 나가 메인 남주 대신 죽을 운명이잖아? 여기서 죽을 수는 없어! 내 목표는 단 하나, 주인공들 근처엔 얼씬도 하지 말고, 
건강하게 버티다가 집으로 돌아가기다.
잠깐? 피하려던 메인 남주 세드리크와 메인 여주 크리스텔이 계속 다가온다?
로맨스는 너희 둘이 하면 되잖아! 나는 판타지만 조금 빌려쓴다니까?"
인섹터,"어느 날 학교에서 담임교사가 <공벌레 인섹터 내라해치>가 되어 
반 아이들을 무차별적으로 살해한 사건이 벌어진다. 
그때 나타난 검은 개미, 그는 반 아이들을 구하게 되고 이 사건을 시작으로 
언론과 SNS로 퍼져 인섹터의 존재는 더 이상 도시 괴담 수준의 이야기가 아니게 된다. 
결국, 정부는 비밀리에 임무를 수행하던 인섹터 퇴치반 버그리퍼를 내세우고 생존자의 증언에 따라 검은 개미를 뒤쫓게 되는데,
검은 개미의 정체는 몸속에 개미 집이 지어진 채 살아가는 평범한 학생 가미성. 
그저 몸속 개미들에게 먹히지 않기 위해 인섹터의
대항마로 변신하여 내키지 않는 싸움을 한다."
강남의 기사,"화려한 현대 도시 강남에 원인 모를 재난이 닥친다. 온갖 괴물들과 악마에게 영혼을 
판 듯한 마법사들이 하늘과 땅 그리고 바다에서 동시에 나타난다. 
현대의 무기나 과학으로 도저히 대적할 수 없는 차원이 다른 적에게 강남은 지옥으로 변모한다."
역주행!,"""지금 인기 급상승 1위가 네 영상이라고!""
직캠 하나로 하루아침에 역주행에 성공한 5년차 무명 아이돌 성준, 그리고 성준과 엮이며 서서히 팬이 되어가는 아윤.
마냥 꿈과 희망만 있진 않은, 한 아이돌과 팬의 이야기!
<일진이 사나워> 김현아 작가의 아이돌 드라마 신작."
다시쓰는 연애사,"대학 시절 구 여친 ‘한서리’와 함께 교통사고를 당한 ‘이제야’. 
눈을 떠보니 10년 전 대학생 시절로 돌아와 버렸다. 그것도 서로의 몸이 뒤바뀐 채로.
제야는 이곳에서 실패했던 서리와의 연애를 다시 써보고 싶다.
""제야야. 날 다시 만나고 싶어? 그럼 날 다시 꼬셔봐.""
과연 제야는 서리의 몸으로 서리를 꼬실 수 있을까?"
피폐물의 해피엔딩을 위하여,"'나'는 피폐한 남주인공들이 신녀 ‘벨’을 소유하기 위해 수단과 방법을 가리지 않는 배드 엔딩 소설 [여명의 기적] 속으로 빙의했다. 
주인공의 행복을 방해하는 걸림돌 로지아나로 환생한 나는 생각한다. ""어쩌면 내가 이 소설의 엔딩을 바꿀 수 있지 않을까?"""
하루의 하루,"오하루는 다른 사람의 마음을 읽을 수 있는 초능력자다.
얼마 전, 저주 받은 능력 때문에 첫사랑도 허무하게 깨져버리고
건조한 일상을 보내고 있던 하루에게 최근 신경쓰이는 사람이 생겼다.

그 사람은 바로, 같은 과 동기인 도하루.
그녀의 마음은 도무지 보이지 않는다. 이건 혹시.. 운명..?"
불청객,"사랑스러운 부부 생활툰을 연재하는 인기 웹툰작가 은영,
그녀의 결혼생활은 웹툰과는 달리 불행으로 가득 차 있다.
그러던 어느 날, 술에 취해 눈 떠보니 남편이 시체가 되어 있었다.
때마침 들이닥치는 불청객들, 그들로부터 남편의 시체를 숨겨야 한다!"
헬크래프트,"세상에 배신당해 방구석으로 도망친 고등학생 염승기.
새로운 지옥의 주인으로 지목된 대악마 바함무르크.

바함무르크는 자신의 지옥 제작자로서 염승기를 선택하고,
지옥 제작의 대가로 염승기에게 수감자를 고를 권리를 준다.

복수를 위해 악마와 손을 잡은 염승기, 그렇게 윈윈의 관계로 끝날 줄 알았는데...

갑자기 시작된 데스게임-
살아남기 위해선 지옥에 보내라!"
원하나,"같은 얼굴을 한 쌍둥이들은 상반된 삶을 살고 있었다. 
한 명은 빛나는 아역배우, 한 명은 연약한 몸으로 힘들어 하는 삶.
그러던 어느 날 둘은 뒤바뀐 삶을 살게 되는데, 동경했던 너의 삶은 행복일까, 불행일까."
아슈타르테,"무한한 영광을 가져다줄 피렌체 제국의 빛,아슈타르테. 하지만 음모로 인해 예언은 뒤틀리고...
아슈타르테가 어둠으로 알려지게 되면서 모두가 그녀를 외면한다. 가족들의 사랑을 꿈꾸던 어린아이에서 점점 강인한 소녀로 자라는 '아슈타르테'의 성장기."
우산 없는 애,"화목한 가정에서 자란 여름은 밤마다 부부 싸움 소리가 들리는 윗집 남자애 수완을 종종 챙겨주었다.
놀이공원에서 아르바이트를 하게 된 여름은 엄마와 놀이공원에 가보고 싶다는 수완의 말에 티켓을 선물한다.
얼마 후, 놀이공원에 놀러 온 수완과 아줌마를 보며 흐뭇해하던 여름. 그러나 아줌마의 돌발행동에 당황하는데..."
사랑의 헌옷수거함,"짝사랑은 이제 그만! 고잉고등학교에서 가장 핫한 소문, 헌옷수거함에 돈을 넣고 좋아하는 사람의 이름을 외치면 상대방의 마음을 알려준다는데..!
연애 대신 성적과 돈에만 관심 있는 송아람은 그런 소문에 휘둘리지 않는다.
그런 아람의 일상에 학교 인기남 정진우가 불쑥 들어온다. 어디로 튈지 모르는 이 자식을 어떻게 해야 좋을까?"
라서드,"절대적 권능을 지닌 11인의 왕과, 왕을 수호하기 위한 기사단이 존재하는 세계.
수습기사 힌타는 파트너 캐넛과 함께 정식 기사가 되기 위한 모험을 떠나는데...
정식기사가 되기 위한 소년들의 고군분투 정통판타지액션!"
주작연애,"""야야 저기 니 여친 지나간다ㅋㅋ""
""뭐?죽을래?""
공부말고는 잘하는 것 하나 없는 이세경. 같은 학교 아이들에게 늘 저런식으로 괴롭힘 당한다.
그런 그녀가 학교만 나가면 인싸녀 그 자체?!
학교와의 정반대의 모습에 모두가 알아보지 못하고 심지어 성인 남자들도 그녀가 고딩인줄 모르고 세경에게 만나달라고 애걸복걸하는데.
사람들을 속이며 재미 좀 보려는데 뭐야, 저건?
하필 걸려도 같은 반의 앙숙인, 하선우한테 정체를 들키는데?!
어른도 아닌, 그렇다고 아이도 아닌 청소년들의 방황,사랑,청춘.
달콤매콤 톡톡쏘는 사춘기 로맨스가 시작된다!"
입술이 예쁜 남자,"10년 전 첫키스의 주인공이었던 동생친구가 완벽한 어른남자가 되어 나타났다.
여전히 예쁜 입술로 예쁜 말만 골라 하며 작정한 듯 한비를 홀리기 시작하는데...
이 아슬아슬한 줄타기는 누구의 승리로 끝나게 될까?"
토마토가 돼라!,껄렁한 겉모습으로 인해 음험한 소문을 몰고 다니는 시골 토박이 전학생 신이석은 첫눈에 반한 전교 1등 수재 조해주의 앙큼한 비밀을 목격하게 되고... 그에 대한 의문은 점차 눈덩이처럼 불어나기만 한다. 겉만 번지르르 붉고 속은 흰 사과 같은 조해주에게 진성 토마토 신이석의 짝사랑 폭격이 시작된다!
도깨비 부른다,"국내 최대 마약상 <귀사회>
귀사회를 중심으로 다섯 명의 아이들이 모이게 된다.
그들은 각자 다른 목적을 위해 귀사회의 돈을 노리게 되지만,
결국 잔혹한 진실을 마주하며 세상을 구하려 한다."
악당과 악당이 만나면,"귀족들을 상대로 악명을 떨치던 제국 뒷세계 조직의 보스, 아탈란테. 
어느 날 황제로부터 폭군 리오넬 비안크 대공을 암살해 달라는 의뢰를 받게 된다.
조직원들과 평범하게 살고 싶었던 아탈란테는 의뢰를 수락하고 
대공성에 잠입해 암살 시도하는데….
하지만 어째서인지 죽지 않아?
한순간에 사랑을 속삭이는 대공에게서 아탈란테는 무사히 탈출할 수 있을까?"
