title,story
작전명 순정,"내 남자친구와 절친의 키스를 목격했다. 그것도 하필이면 재수 없는 같은 반 남자애 '고은혁'과 함께.
안 그래도 혼란스러운데.. 사람마다 평생 받을 사랑의 양이 정해져있다고?? 심지어 내가 받을 수 있는 사랑의 양은 '0'???
알거지 운명을 바꿔보려는 수애와, 그런 수애에게 말려든 은혁의 맞바람 작전!
바람피우는 '척'만 하려고 했는데 점점 진짜로 끌린다?! 이 계획... 과연 성공할 수 있을까?"
디펜스 게임의 폭군이 되었다,"타워디펜스&던전오펜스 RPG <제국을 지켜라>
누구도 클리어하지 못한 난이도로 게임의 엔딩을 봤다.
그런데 정신을 차리니 게임 속이다.
그것도 공략이 불가능한 튜토리얼 스테이지다.
""반드시 클리어해 주마, 이 거지 같은 게임……!"""
나이트런,"우주력 430년. 성간이동이 가능해져 별과 별을 이동하는 시대
인간은 괴수와 싸우고 있다. 기사와 함께.광활한 우주를 배경으로 판타지 SF가 다가온다."
마도전생기,"정파무림 의천맹의 최강 살수, 천하진.

자유를 찾기 위해 탈출을 감행하지만 코앞에서 목숨을 잃고 만다.

그런데… 
'신교불패, 만마앙복. 삼공자님의 쾌유를 경하드리옵니다!'
무림의 공적, 마교의 삼공자로 전생해버렸다?!

정파무림 최강 비밀병기 천하진의 마도무림 정복기."
"나태 공자, 노력 천재 되다
휴재","잠을 도피처로 삼아 온 소년 아이른 파레이라.
사람들은 그를 나태 공자라 부르며 조롱했지만 그는 변할 생각이 없었다.
어느 날 어느 검사의 꿈을 꾸기 전까지는...
그것은 그저 묵묵히 수십 년간 검을 휘두르며 단련하는 한 재능 없는 사내에 관한 꿈이었다."
청춘 블라썸,"“푸르지 않아도 괜찮아!”
이제 막 청춘을 시작하고 있는 아이들.
그리고 마냥 아름답지만은 않은 그 시절의 기억들.
봄으로 가기 위한 그들의 성장통.
봄, 여름, 가을, 겨울... 사계절의 빛깔로 담아낸
풋풋하고 알싸한 아이들의 청춘 스토리."
윌유메리미,"외모는 상남자, 마음은 감성소녀 윌.외모는 청순녀, 마음은 터프가이 메리! 
서울 부산 띠동갑 커플의 리얼 연애 일기"
물위의 우리,"수차례의 지각변동 이후 해수면이 급격히 상승한 지구. 딸 한별이에게 더 넓은 세상을 보여주고 싶은 호주는 한별이와 고향으로 향한다. 
20년 만에 찾은 고향에는 수상한 행적들이 가득한데...과연 둘은 무사히 살아갈 수 있을까?
2020 최강자전 최우수상 수상작!"
반드시 해피엔딩,"쇼윈도 부부를 끝내는 날, 남편이 죽었다.
슬픔에 잠긴 아내, 연우에게 100일의 시간이 다시 찾아온다!
연우는 남편, 선재의 죽음을 막기 위해 고군분투하는데…
 
두 번째 인생에서야 겨우 시작된 ‘진짜’ 결혼생활.
뒤늦게 썸 타는 부부의 아슬아슬 안달복달 생명유지 로맨스.
‘이번 생은 내가 반드시 해피엔딩으로 해줄 거예요!’"
나를 바꿔줘,"수상한 생명보험에 드는 조건으로, 하루 아침에 내가 원하는 외모로 살 수 있게 된다면? 
인생을 바꾸기 위해 얼굴을 훔치다!"
이종 격투기,"1인 심부름센터를 운영하는 주인공 형담은 보름달이 뜨는 밤이면 다른 인종으로 변해버리는 비밀을 가지고 있다. 
통제와 제어가 불가능한 변화는 때에 따라서 백인이나 흑인, 그 외의 다른 인종으로 거듭나는데 형담은 그런 주기마다 자신을 대하는 사람들의 모습과 스스로가 세상을 바라보는 시선의 변화로 인해 고군분투한다.
힘든 나날을 보내던 형담은 우연한 사건을 계기로 자신의 비밀이 만천하에 밝혀지게 되고 온갖 매체를 통해 소비되어 가는데..."
나랑X할래?,"성인웹툰작가를 꿈꾸는 봄, 정작 현실 남자들에게 찌릿함을 느껴본 적은 없다. 오로지 그녀의 심장을 뛰게 하는 건 8년간 꿈에서만 만져 봤던 첫사랑 ‘정태양’뿐… 그 남자가 그녀 앞에 나타났다. 글 작가 ‘써니’님으로! 성인 웹툰 공모전 수상을 위한 동거를 시작하는데 대뜸 내 던지는 태양의 첫 마디 ‘경험 없는 게 그렇게 중요합니까? 그럼 봄님이 알려주시죠’ 이 동거… 진짜 괜찮은거야?!!"
민간인 통제구역 - 일급기밀,"2002년 6월, 대한민국 최전방 부대 1813GP에서 총기난사사건이 발생한다. 
헌병 수사과의 초임장교 박두일은 조사팀에 투입되지만, 수사가 진행될수록 이 사건 속 감춰진 불편한 진실을 마주하면서 정의에 대한 신념이 흔들리기 시작한다."
이십팔세기 광팬,"망한 작가 이지음의 앞에 이십팔세기에서 지음의 광팬, 최강팬이 찾아온다. 강팬은 지음이 단명한다는 사실을 알려주고, 지음이 무병장수해서 다작할 수 있도록 돕겠다고 한다. 그런데 이럴 수가. 책 뿐만 아니라 인생까지 망할 것 같다."
미나 이퀄,"열혈 소방관 강호는 사명감으로 모든 것을 바쳐 많은 사람들을 구해내었으나,
돌아온 건, 불구가 된 몸과 처참한 죽임을 당한 아내, 세상으로부터의 배신이었다.
그는 자신의 방법대로 복수를 결심하는데, 비록 자신이 구했으나, 
새 삶을 살 가치가 없다 판단되는 이들의 목숨을 도로 회수하는 것. 
그리곤 그 복수를 이행하기 위해 딸 '미나'를 냉혹한 킬러로 키워낸다. 
시간이 흘러 10년 후,고등학생이 된 딸이 킬러로서 완성되었다 생각한 강호는
지정한 타겟의 생명을 회수하라는 첫 미션을 내리는데...."
대충 캠퍼스로맨스임,"평범한 대학생 하윤. 갑자기 떠난 여행에서 강온을 마주친다. 
강온은 하윤에게 한눈에 반하여 고백을 하지만, 하윤은 그를 거절한다. 
그리고 다신 볼 일 없을 것이라 생각했던 둘은 학교 동아리 모집기간에 재회하게 되는데..! 
어라? 어쩌다보니 동아리 '그대'에 같이 들어가고, 에? '그대'의 회장 지일 마저 하윤을 좋아한다고?! ㅋㅋ이거 망상 아님. 진짜임."
당신이 나를 믿으신다면,'수민'은 우연한 기회에 사이비 종교의 신도인 '가나'의 통화를 엿듣게 된다. 길거리에서 전단지를 나눠주며 사람들을 귀찮게 하는 가나의 모습을 본 수민은 장난기가 발동해 자신이 엿들은 통화 내용으로 허풍을 떤다. 사이비 종교인에게 참교육을 했다며 기분 좋게 그 자리를 뜨는 수민. 하지만 그녀는 깨닫지 못한다. 가나에게는 그 순간이 새로운 메시아의 강림이었다는 걸.
어글리후드,"외계인이 유일신으로 군림한 미친 세상, 
바꾸고싶다면 사탄이 되어라"
간첩 18세,"어린시절부터 북한에서 훈련받은 고아 출신 하진.
그는 어린소년들을 내려보내 남한의 고위층으로 키우고자 하는 북의 계획에 발탁되어 남한으로 넘어온다.
“이용당하지 않기 위해선 먹는쪽에 서야 한다”
북에 이용당하기 보다 이용하고자 하는 그는 볼모로잡힌 동생을 구할 힘을 가지기 위해
남과북의 조직들을 하나씩 잡아먹는다."
노인의 꿈,"화가의 꿈을 포기한 채 동네에서 작은 미술 학원을 운영하는 '봄희'.어느날 그녀의 학원에 나이가 지긋한 할머니 '춘애'가 찾아온다. 
춘애가 그리고 싶은 것은 다름 아닌 본인의 자화상이었고, 이것을 영정 사진으로 쓰고 싶다고 이야기 한다. 
열 번의 수업을 하는 동안 봄희는 자신의 지난 삶과 상처들을 돌아보게 되고, 춘애는 과연 자화상을 완성해 마지막 꿈을 이룰 수 있을까? 
<화가 살리에르> 백원달 작가가 들려주는, 황혼을 향해 걸어가는 우리 모두의 이야기."
존잘주의,"외모로 고통받던 나에게 악마가 나타나 매력적인 제안을 한다!
클릭 한번으로 내가 원하는 외모로 만들 수 있다고?
CUTE SEXY PURE LUXURY! 스탯을 올려 원하는 외모를 만들라고?!

그런데 있잖아..
예뻐지기만 하면 행복해질 줄 알았는데...
그게 아닌걸까?"
탑코너,"소설가의 꿈을 가진 수학 천재소년 안시준. 
우연히 광진고 축구부의 유망주 허도형과 만나게 된다. 

뜻밖의 사건으로 시준에게 잠재된 축구 재능을 발견한 도형.
팀을 구하기 위해 시준에게 은밀한 거래를 제안하지만..

"".. 난 축구는 한 번도 해본 적 없는데..?""

과연 시준은 위기에 빠진 광진고 축구부의
구세주가 될 수 있을까?

꿈을 좇는 소년들의 축구드라마. 수학 천재의 킥오프가 시작된다!"
홍시는 날 좋아해!,"스무 살 고3 홍시호가 전학 왔어요! 방긋방긋 웃는 모습 뒤에는 어떤 비밀이...?
단내 나는 홍시가 예쁘게 여물어가는 이야기."
이계진입 리로디드,"왕의 심장이 불타 사라질 때, 현세의 운명을 초월한 존재가 이 땅에 강림하리라! 
폭군을 쓰러트리고 이세계를 구원한 지구인 소년 성시한. 
해피엔딩인 줄 알았건만, 그 대가는 모든 걸 빼앗기고 지구로 추방되는 것이었다. 
이에 시한은 10년의 절치부심 끝에 테라노어로 되돌아오게 되는데… 한 번 세상을 구한 영웅의 이계 ‘재’진입 이야기!"
더 캐슬 - 귀안의 신부,"그림 속에 숨어 사는 그림 도깨비를 보고 자란 유연. 왕세자와 딸을 혼인시키기 위해 유연의 눈이 필요하다는 최 회장에게 자신의 엄마를 살리는 조건으로 유연은 왕실을 상대로 한 결혼 사기극에 동참하기로 한다.
 
“왕실 역사상 처음이야. 사기 결혼이라니.”"
엑스애쉬,"[<노블레스> 이광수 X <열렙전사> 김세훈]
도둑질의 천재 엑스와 수수께끼의 과거를 지닌 애쉬.
기사단 제일 검, 류와 운명적인 만남으로 기사가 되기로 한다!
인류 최강의 존재들만 모이는 기사단의 시험장,
엑스와 애쉬는 모든 것을 가진 엘리트 귀족들과 경쟁하여 승리해야 한다!
과연 그들은 기사가 될 수 있을 것인가?
그리고 그 이후에 그들 앞에 펼쳐질 잔혹한 운명은…?"
더 해머,"마왕군 7군단장의 머리통을 최후의 일격으로 깨버린 뒤, 죽을 위기에 처한 '타이니'. 
인류의 멸망을 막을 수 없는 절망적인 상황에서 유일하게 숨이 붙어있던 전우, '검제'는 가보의 힘을 이용해 타이니를 회귀시킨다.
대륙 최고의 기사에서 빈민가 고아로 돌아와버린 타이니는 전생엔 없던 새로운 힘을 얻으며 강한 잠재력을 갖게 된다.
이번 생은 과연, 인류의 멸망을 막을 수 있을까?"
용사참수인,"사형집행인으로 용사를 참수하고 은퇴하여 자유인이 된 데닐 패트릭은 한적한 산골에서 무료한 나날을 보낸다.
그러던 어느 날 난데없이 딸이라고 찾아온 아이의 등장에 데닐 패트릭의 인생은 산골을 벗어나 전 대륙을 향하게 되는데..."
폭군 남편과 이혼하겠습니다,"로판소설 속 황후에게 빙의했다. 좋은 거 아니냐고? 
문제는 이 황후가 간사한 황비에게 밀려서 황제에게 박대당하고 결국 병으로 죽는 조연이라는 것이다.
하지만, 원작 황후처럼 허무하게 죽을 순 없다. 폭군 남주와 이혼하기 위해서 악녀가 되어야겠다."
왕세자 입학도,"조선 후기, 성균관에 자그마한 신참이 들어온다! 
모종의 이유로 정체를 숨기고 성균관 유생이 된 
왕세자가 보고 겪는 체험! 민중의 현장!"
전생연분,"'내가 후궁에게 살해당한 조선의 왕비?!'
시험을 보다가 갑자기 전생을 떠올리게 된 민주.
크게 당황하지만, 전생보다 중요한 것은 대입이었기에 애써 마음을 추스른다.
하지만 전생의 철천지 원수였던 후궁이 민주를 찾아오고
뒤이어 전생에 남편이었던 왕까지 나타나면서 민주의 수험생활은 위기를 맞는데....
'전생이고 나발이고 제발 공부 좀 하자!!'"
"저무는 해, 시린 눈","태양의 신 카리야의 가호를 받은 마녀 '힐데가르'.
고향을 잃은 북부인 '에르킨'은 마녀를 쫓아 이름 없는 성으로 향한다."
묘령의 황자,"여인임을 숨기고 사내로 사는 삶을 택한 4황자 적연. 
불사불멸의 신이 될 수 있는 황좌를 두고 열린 경연에 참가한다. 
황자는 스무 명, 제위는 하나. 첨예한 대립 속에서 오래된 음모 하나가 서서히 베일을 벗고, 
세간에 알려진 바와 달리 점점 두각을 드러내는 적연을 지켜보는 시선들이 어쩐지 짙고 깊어지는데.. 
묘령의 황자를 둘러싸고 화려하게 피어나는 애증의 서사시."
완벽한 부부는 없다,"남편의 이혼 요구를 피하고 싶은 연화는 갑작스러운 사고 후 기억을 잃은 척 연기하게 되는데… 차가웠던 남편이 갑자기 달라졌다! ""원래 당신이 이렇게 다정했나요?"""
"공유몽
휴재","잠이 들면 또 다른 세계가 펼쳐진다!
꿈을 빼앗긴 자들이 모이는 곳 ‘큐브’
고유한 능력과 아이템을 부여받은 ‘큐버’
존재하지 않았던 일곱 번째 형태의 아이템을 계승한 ‘도시언’의 성장 액션 먼치킨 판타지!"
내게 필요한 NO맨스,"베프의 결혼식에서 나 혼자 솔로임을 알게 된 아연.
아연은 혼자 남을 두려움에 신을 원망한다.
그리고 갑자기 엄청난 남자들과 엮이기 시작하는데..?
2019 지상 최대 공모전 3기 장려상 수상작!"
최강부캐,"""새로운 나를 깨워라""
체감형 VR MMORPG 게임 <에르고스피어 온라인>에서 ""힐러 셔틀""을 하던 고등학생 이오름은 
어느날 자신이 남몰래 키워둔 최강의 부캐 ""어벤져""가 되어버리고 만다. 
그리고 연이어 나타나는 몬스터들과 각종 퀘스트들. 
이오름은 모든 위기를 이겨내고 새로운 내가 될 수 있을까. 
본격 부캐 활극 현대 판타지."
봐선 안되는 것,"귀신, 환각, 괴물, 이상한 형체...
눈에 들어온 그 순간 벗어날 수 없다.
당신의 마음 속 두려움을 건드리는 공포 옴니버스 웹툰 <봐선 안되는 것>"
키스 식스 센스,"키스하는 순간 미래가 보인다!
키스하면 미래가 보이는 예술은 실수로 상사 차민후 팀장의 목에 키스를 한다.
그 순간 예술은 미래에 차민후와 함께있는 자신의 모습을 보게 되는데……
그런데 왜 하필 침대에서 뒹구는 모습인 거야?!
썸은 커녕 언젠가 회사 그만 둘 때 꼭 뒷통수 한 대 후려치고 갈 생각이었는데…!
어떻게든 끔찍한 미래가 현실이 되지 않게 열심히 부정해보지만
이 남자, 자꾸만 나한테 다가온다!
원수보다 못한 우리 사이, 진짜 로맨스가 있긴 한 거야?!
아슬아슬, 화끈한 초감각 로맨스 <키스 식스 센스>."
은둔코인,"은둔형 외톨이이자 완포세대인 청년 '구석기'. 
무리하게 투자한 코인은 떡락하고, 하루하루 무의미한 삶을 보내던 어느 날. 
집에 처박혀 허송세월 흘려버린 날들을 능력치로 교환할 수 있는 기적의 '은둔코인' 앱을 얻게 되는데. 
과연 석기는 포기하며 살아온 것들을 다시 손에 넣을 수 있을 것인가!"
소년 검사,"세계적으로 주목받는 VR 온라인 게임, '퀘스트 히어로'. 
이곳의 네임드 유저인 '하랑'은 알 수 없는 검은 형체에 이끌려 다른 세계로 끌려간다. 
아무리 시도해 봐도 로그아웃은 되지 않고, 설상가상으로 공격까지 당하게 되는데... 
'진짜'로 아픔이 느껴지는 것도 모자라, NPC 유타가 아닌 '진짜' 유타까지 만난다. 
과연 하랑은 '7번의 퀘스트'를 모두 완료하고, 무사히 집으로 돌아갈 수 있을까!? 
낯선 세계에 떨어진 '소년 검사' 하랑의 여정이 시작된다!"
"다비, 아찔하게 흐르는","압록강 이북에서 찻잎을 파는 심 다점의 주인 '단이'는 
한 남자의 도움으로 목숨을 건지게 된다. 
목숨을 구해준 남자의 정체는 여진족이라면 가차 없이 베어버리는 냉혈인,
저주받은 북방 귀신이라 불리는 조선의 장군 '서 결'.

저주를 받아 물 대신 독한 차만 마실 수 있는 그는,
아이들을 끌고 가 자신의 차를 끓이는 다동으로 삼고 잡아먹는다고 하는데...

그런 그의 다동... 아니 다비로 거두어지게 된 단이는 
북방 귀신의 집에서 무사히 지낼 수 있을까?!"
배달의 신,"이승으로 쫓겨난 개념 없는 신의 아들 ‘달수’
소꿉친구이자 황천에서 손맛 알아주는 셰프 ‘리사’와 함께 황천으로 돌아가기 위한 행복 맛집 배달을 시작한다!"
"마법사가 죽음을 맞이하는 방법
휴재","“이제 끝내고 싶어.”
사악한 드래곤을 없애야 죽을 수 있다는 저주로 인해, 300년이라는 긴 시간을 살아온 대마법사 엔테. 
마침내 드래곤을 물리치고 안식을 맞이했으나 
눈을 뜬 곳은 사후세계가 아닌, 휘황찬란한 귀족 저택이었다. 
더군다나 마법이라곤 로맨스 판타지 소설밖에 모르는 귀족 영애의 몸에 빙의되었는데..."
왕년엔 용사님,"동네 슈퍼 아줌마 '명옥'에게
어딘가 낯익은 불청객이 찾아온다.
""뭐?! 마왕을 봉인해달라니, 난 올해로 49살이라고!!""
2019 최강자전 대상 수상작!"
키스의 여왕,"누구라도 보는 순간 키스하고 싶게 만드는 여자, ‘키스의 여왕’이라는 별명을 가진 월드스타 손유리는 IT 업계의 억만장자 데이브 천과의 드라마틱한 열애 후 성대한 결혼식을 올린다.
평범한 신혼여행을 거부하고 지상 최고의 허니문 여행을 떠난 그녀는 로맨틱한 첫날밤에 미친 사랑과 거대한 운명의 폭풍에 휩싸이게 되는데…
“당신이 알던 그 남자는 죽었어.”"
사서고생!,"이름 안은수, 나이 23세, 대기업 고졸 정규직, 4년차 직장인.
재미는 없어도 무소식이 희소식인 법. 이대로만 살면 더 바랄 게 없는 일상이었지만 주변 상황들은 그런 은수를 가만히 내버려두지 않고..
사서 고생, 살아서 고생! 제대로된 어른이 되고 싶은 애어른 안은수의 청춘성장드라마!"
청춘일지,"지긋지긋한 재수생활을 딛고 설레는 마음으로 들어선 대학.
대학에 대한 로망이 백만 가지쯤 되는 다봄은 첫날부터 빌런과 마주하게 되는데…
시작부터 어딘가 삐걱! 이대로 내 캠퍼스 생활 괜찮은 걸까?!"
중매쟁이 아가 황녀님,"피폐 소설 속 아가 황녀로 환생하게 된 주인공은,
자신을 키우면서 고생하는 이모를 위해 폭군 남주인 삼촌이 있는 궁으로 들어설 결심을 한다.
그런데 실제로 만난 삼촌은, 그저 애정결핍이 쪼~끔 있어보일 뿐인데..?
이모도 사랑하고 삼촌도 사랑하는, 아가 황녀님의 러블리 중매 소동"
애구애구,"선천적으로 한쪽 눈이 없이 태어난 강아지 ‘애구’.
젖도 떼지 못하고 산골짜기에 유기된 애구는 고라니 남매 ‘고니’와 ‘라니’를 만나게 된다. 
'강아지 헌법 323조(?)에 의하면, 한동안 주인과 떨어져 여행을 해야 한다고?'
버림받은 사실조차 모르는 순수한 애구는 함께 모험을 떠나지만, 험난한 야생과 인간들이 그들의 앞길을 가로막기 시작한다.
과연 그들은 차가운 세상 속 따뜻한 보금자리를 얻을 수 있을까? 유기견과 야생 고라니의 모험 생존기!"
용두사망 소설 속의 악녀가 되었다,"엔딩 직전 느닷없이 제국이 멸망하는 '용두사망' 소설 속 악녀에게 빙의했다.
 
마계 침략으로부터 살아남기 위해 망명을 계획하지만
침략의 원흉이자 마왕의 정체를 숨기고 있는 남자, 아르비스 대공이
100년을 기다렸다며 애절한 고백을 털어 놓는데···.
 
나, 이 용두사망 소설 속에서 살아남을 수 있을까?"
7FATES: CHAKHO,"타락한 도시 신시, 길에서 마주친 수수께끼의 사내가 제하에게 의문의 말을 던진다.
하지만 병원에서 깨어난 제하는 그날의 일을 기억하지 못하고...
현세에 존재해선 안될 범이라는 존재들이 도시를 재앙으로 물들일 때, 
일곱개의 운명이 엮어져, 그들에 맞서기 위해 무기를 든다. 이제 범을 사냥할 시간이다."
시선 끝 브로콜리,"대인기피증을 가진 유채는 혼자가 편하다.
하지만 같은 과 친구 누리의 집요함으로 원치 않는 동아리 활동을 하게 될 위기에 놓이게 된다. 
하지만 자신이 꿈꾸던 완벽한 보더콜리의 탈을 쓴 건오를 만나게 되고,
자신도 모르게 동아리 활동을 수락 해버린 유채.
친구들에게 끌려간 회식자리에서 갑자기 주변 사람들의 모습이 다 개로 보이게 된다.
뭐야 탈이 아니였어?"
궤도의 아이들,"""누나에게서는 빛이 나는 것 같아. 
너에게마저, 누나는 그런 존재일까?"" 
어딜 가나 모두의 주목을 받는 남매, 류빈과 류성. 
그러나 빈에게는 비밀이 있었는데, 그것은 동급생인 영인을 짝사랑하고 있다는 것. 
누나인 빈에게 남모를 열등감을 품고 있던 남동생 성은, 
수더분하고 조용한 소녀 영인에게 접근하기 시작한다. 
어른이 되어가는 세 명의 아이들과 
조금은 요란한 그들의 성장담."
아가사,"‘다만 너를 사랑한 것이 나의 죄였다...’

그저 사랑하는 이와의 자유로운 일생을 꿈꾸었던 왕비 '아가사'.
두 눈이 가려진 채 살아온 그녀 앞에, 은밀하게 감춰져 왔던 왕국의 비밀들이 드러나게 되는데... 

어둠 속 마주한 진실의 끝자락.
배신과 암투, 갈망과 사랑, 인간적인 고뇌와 선택... 
과연 그녀는 무너지지 않고 여명의 끝자락을 붙잡을 수 있을까."
아침을 지나 밤으로,"'사과나무의 대가로 48일간 아이를 빌려가겠습니다'
기묘한 편지와 함께 사라진 동생 녹스를 찾아 헤매는 마네의 모험을 그린 정통 판타지
2019년 네이버웹툰 최강자전 2위 수상작!"
아이돌만 하고 싶었는데,"생방송 무대에서 쌍코피가 거하게 터진 뒤로 폭발적인 인기를 얻게 된 <유로파>의 멤버 빛나. 
앞으로 승승장구할 생각에 들떠있던 것도 잠시, 그날 이후로 자신의 몸이 달라졌음을 알게 된다. 
<어웨이큰>의 멤버 찬선과 함께 주변에서 일어나는 수상한 일들을 파헤치게 되고 자신들이 위험한 일에 휘말렸다는 것도 알게 된다. 
하지만 이제 와서 도망칠 수도 없는 상황. 
피 튀기고 혼란스러운 일상 속에서 그들은 과연 끝까지 아이돌이란 신분을 지킬 수 있을까..?"
밤을 깨우는 마법,"해와 달이 사라져 영원한 밤에 갇힌 숲의 왕국 아르타. 
마법 때문에 망한 왕국에서 하필 마법사로 태어난 루시는 도망치는 삶을 살아간다. 

우연히 왕국 기사 하일에게 정체를 들키고 만 루시.
이제 죽는 줄 알았는데... 되려 '공주를 구해달라'는 뜻밖의 제안을 받게 된다. 
쓸모없다 여겨온 마법이 저주를 풀 열쇠가 될 수 있을까?"
숨겨진 성녀,"오래 전, 성녀를 사랑했던 성기사가 있었다. 사사로운 감정을 가지면 안 되는 성녀에게 해가 될까 그는 늘 한 발짝 떨어져서 성녀를 지켰다. 하지만 성녀는 결국 성기사의 품에서 최후를 맞이하고, 성기사는 비통하게 맹세했다. ‘제게 다음 생이 있다면, 그때는 당신을 성녀로 살게 하지 않겠습니다.’ 
기나긴 300년의 시간이 흘러, 성녀는 다시태어났다. 이번 생에는 두사람의 염원이 이루어질 수 있을까?"
먹지마세요,"달콤한 복숭아 소년(?)
요괴와 귀신들에게 쫓기다."
겨울특강,"가난하다는 이유로 힘을 숨기고 일진들의 괴롭힘을 참아내는 고등학생 한길은
아르바이트를 하고 집으로 돌아가던 길에 도깨비 방망이를 쓰는 사람들을 보게 된다.
그들로부터 도깨비 방망이를 훔치는데 성공한 한길은 이제 돈 걱정 없이 살 수 있을 줄 알았지만
인간의 탈을 쓴 괴물들 ‘야인’과 야인들을 사냥하는 조직 ‘꾼’들의 세계에 엮이게 된다.
가진 거라곤 힘밖에 없던 소년 한길은 또다른 인생의 챕터에 들어서게 되는데..."
