title,story
"나노마신
휴재","갖은 멸시와 목숨의 위협을 받던 마교의 사생아 천여운, 
미래에서 나타난 후손이 천여운의 몸에 나노 머신을 주입한 후 그의 인생이 송두리째 바뀐다.
마교를 넘어 무림 최고의 자리에 오르기 위한 천여운의 거침없는 이야기가 시작된다!"
남편을 죽여줘요,"고향 풍경을 그리던 공작부인은
외간 남자에 의해, 새로운 욕망의 눈을 뜬다.
'시대가 금지한, 남자의 나체를 그리고 싶다!'
그런 공작부인을 독점하고 싶은 남자들.

그리고 살인사건이 일어난다.
사건의 이면에는 무슨 일이 있었던걸까?"
천마육성,"마교의 태왕각주 ‘사마귀’의 명령으로 화산파 출목지역으로 파견나간 비객조.
‘설휘’는 화산파의 절대고수 ‘구종명’에게 죽임을 당할 위기에 처한다.
그 때 눈앞에 상태창이 나타나고 정찰임무를 받기 직전으로 회귀하게 된다.
설휘는 자신이 전생에서 죽임을 당했던 똑같은 임무를 받게 되자 주변의 환경을 조금이라도 바꾸어 살아남고자 발버둥친다.
고비마다 눈앞에 나타나는 선택창, 미래를 알 수 없는 지문들. 삶과 죽음이 공존하는 세상 안에서 최선의 방법을 찾아 나선다."
현실퀘스트,"게임 아이템을 가져오라는 일진의 협박으로 인해
일주일간 밤샘 게임을 하다 죽음을 맞이한 비운의 게임셔틀 하도완
그 순간 일주일 전 교실에서 리스폰되는데...
모든 것이 그날과 똑같다. 달라진 것은 단 하나, 눈앞에 떠있는 <퀘스트 알림>!
뭐? 내가 지금껏 하던 게임들의 스킬을 이용해서 일진을 때려잡으라고?!?!"
무사만리행,"2세기 후반, 마한연맹 고리국(古離國)의 무사 나루.
믿었던 스승의 배신으로 나라가 멸망하고, 평생을 바쳐 지켜주겠노라 맹세했던 소단공주의 행방이 묘연해진다. 
유일한 단서인 서역으로 떠났다는 배신자의 말에 나루는 로마제국의 검투 노예로 팔려가 공주의 행방을 찾고 자유를 얻기 위해 처절한 사투를 벌인다."
나 혼자 네크로맨서,"곧 세상이 멸망한다.
전설 속에나 나올 법한 몬스터들이 각지에 출현한다.
그리고 사람들을 잡아먹고, 길거리를 점령하며, 빌딩과 지하철에 던전을 만들기 시작한다.

멸망한 세계에서 살아남기 위해 단 한 가지 직업을 고를 수 있다.
당신은 무슨 직업을 고르겠는가?
""네크로맨서""

나에게는 멸망이 무대이고, 죽음이 자산이 된다."
회귀한 천재 헌터의 슬기로운 청소생활,"세계 최초 SSS랭크 천재 헌터 김준우. 어느 날 습격을 당해 죽게 되고, 10년 전으로 회귀한다.
스킬은 모두 봉인됐고, 해제를 위해서는 극한 직업인 던전 청소부로 일을 해야 하는데?!
하지만 이 청소부, 남다르다! 현직 헌터보다 더 강한 전직 헌터의 망나니식 청소가 시작된다!
원작 제공 : 영상출판미디어"
호랑신랑뎐,"산 속에 사는 금슬 좋은 부부! 그러나 이 부부에겐 어딘가 특별한 점이 있다.
 그건 바로.. 신랑이 사람처럼 걸어다니고 말도 할 수 있는 호랑이라는데..? 
무뚝뚝하지만 마음씨 착한 호랑이 신랑과 장난스럽고 수다스러운 인간 아내가 만나 벌어지는 좌충우돌 일상 이야기!"
버려진 나의 최애를 위하여,"""내 최애를 살려내!""
N회차 정주행할 만큼 애정하던 로판 소설에 빙의한 헤스티아,
엑스트라 of 엑스트라에 빙의한 덕에 주인공들을 직관하고 드디어 맞이한 작품의 엔딩!
엔딩 후 현실로 돌아가게 될 거란 예상은 산산조각이 나고,
소설의 엔딩 후 비하인드가 가장 애정하는 캐릭터였던 서브남 카엘루스의 죽음이라는 충격에서 벗어나기도 전에
소설의 엔딩 직후로 회귀하는데…!
그렇다면 이번엔, 내 최애를 지켜내겠어!"
보스였음,"<심연의 탑> 보스 바포메트는 자신과 호각으로 싸울 강한 헌터를 기다리고 있다. 반복되는 싸움에 지루함을 느끼던 찰나, 죽은 헌터들의 전리품에 의해 인간 세상에 흥미를 갖게 되고, 동시에 늘 자신이 바랬던 강한 헌터가 눈 앞에 나타나자 그를 보며 인간의 존재에 더욱 더 매료되기 시작한다. 급기야 바포메트는 스스로 인간이 되고자 하는데…"
서울밤피어,"시체 구덩이에서 눈을 뜨는 재이.
운명적으로 만난 반과 피의 계약을 맺고 밤피어의 신부가 된다.
재이는 잃어버린 기억 속 자신의 연인을 찾아 지켜내기 위해
반은 원수 제이콥을 찾기 위해
다른 목적의 두 사람이 운명의 한배를 타고 서울로 향한다."
뮤즈 온 유명,"""부업은 청소도우미, 본업은 무명 배우. 아이러니하게도 내 이름은 유명이다."" 유난히 힘들던 날, 우연히 거장의 사진전에 들어간 무명배우 유명은 자신의 사진을 보게 된다. 그 사진들은 유명이 제일 빛나던 시절을 담고 있었고, 그런 모습은 지금의 유명과는 정반대였다. 유명은 알 수 없는 사진작가의 뮤즈로 스타가 될 수 있을까."
순정빌런,"특수능력을 가진 범죄자를 상대하기 위한 특수경찰이 존재하는 세계. 
평화로운 나날을 보내던 최강의 특수경찰 '한도령'에게 감당할 수 없는 빌런이 찾아온다! 그런데 이 범죄자, 어딘가 이상하다?
최강의 히어로를 사랑하는 최악의 빌런 '박로사'의 우당탕탕 사랑이야기"
별을 삼킨 너에게,"어둠 같은 현실 속에서도 우리가 빛나는 이유는, 
저마다의 별을 품고 있어서가 아닐까?
별처럼 빛나는 우리들의 성장, 그리고 로맨스.
네이버웹툰 최강자전 19년 대표작."
노답소녀,"재벌가 손녀인 가빈은 친구 한 명 없는 왕따에 성격까지 노답이다. 
5억원을 대가로 가빈을 비밀리에 경호하기 위해 전학 온 태웅. 
과연 태웅은 정체를 숨긴 채 가빈을 잘 경호할 수 있을까?"
불쌍해야 하는 남자,"사람의 위치는 처음부터 정해져있다고 믿던 심연후.
하지만 사고로 인해 부상을 얻고 처음으로 다른 사람들의 관심을 받아 본다.
언제나 ‘관심 같은 것에 관심 없어-’라고 생각했지만, 이제 남들의 관심 없이는 안되게 돼버렸다...!
남들에게 관심을 받을 수 있는 유일한 방법.
‘불쌍해야만’ 남들의 관심을 얻을 수 있다면... 어디까지라도 불쌍해지겠다!"
쿠베라,"신의 이름을 가진 소녀 쿠베라 리즈. 15세 생일에 외출에서 돌아오다가 초토화되어버린 마을을 목격하게 되는데..! 신, 수라, 마법사들 사이에서 펼쳐지는 소속불명 장르 혼합 판타지."
특수청소,"자신의 일에 최선을 다하는 1팀 형사 정명석.
명석은 맡고 있던 여중생 성폭행 사건을 종결지으라는 상관에게 항의하다 정직 명령을 받는다.
한편, 대광건설에 온갖 방해와 협박을 받던 성희는 자신의 자존심과 존재 가치를 지키기 위해 맞서싸우기로 결심한다.
두 사람이 위험한 사건에 휘말리게 되며, 부당함에 맞서 싸우게 된다."
규격 외 혈통 천재,"나는 인베이더를 죽이는 사람이 되고 싶다.

인베이더를 죽이고 특수종의 세상에 살며 일상의 행복도 유지하고 싶다.
그걸 바라면 안 될까?
왜? 왜 그래서는 안 되나.
두 마리 토끼를 쫓다가는 둘 다 놓친다고 하지만,
안 놓치면 된다.

불멸자+변신족, 혈통 천재의 액션 판타지"
꽃만 키우는데 너무강함,"험악한 겉모습과 달리 꽃집을 차리는 게 꿈인 순정남 황재호. 자신의 꿈을 이루기 위해 게임을 시작하게 되고, 게임 속에서 꽃집을 운영하기 위한 재호의 긴 여정이 시작된다. 꽃을 사랑한 근육남의 친환경 판타지 액션 활극!"
최강전설 강해효,"맹수같이 거친 문제아 학생들만 모여있는 최강고등학교!!

그곳에서 변화가 시작되었다."
흑막 여주가 날 새엄마로 만들려고 해,"친구들과 장난삼아 쓴 '피폐 소설' 속에 시민 1로 빙의했다. 
그리고 저세상급 딸바보력을 자랑하는 여주인공의 아버지 헨스톤 공작에게 정체를 들켜버렸다. 문제는......
“그럼 내 딸이 피폐 소설에서 어떻게 되는 거지?” 
""......뭐? 남주가 열 명?""
행복하지 못한 딸의 미래를 바꾸기 위해 독립전쟁도 불사하겠다니. 이대로 두었다간 여러 목숨이 위험하다. 
""제가 여주님을 지켜드리겠어요!"" 그렇게 딸바보 공작님과의 동거가 시작됐다. 그런데 쪼그만 여주님이 어쩐지 좀 이상하다. 왜 자꾸 네 아빠랑 날 엮는 건데?"
국세청 망나니,"주인공 '신재현'은, 다니던 기업의 비리를 고발했다는 이유로 직장을 잃고 배신자라 불리게 된다. 이에 굴하지 않고 세무직 공무원 합격을 목표로 했지만, 그마저도 어려운 집안 환경 앞에 흔들린다. 좌절하던 그에게 '은인'이 손을 내밀고, 훗날 국세청의 망나니가 될 자는 비로소 칼을 손에 쥔다. ""탈세자라면 어디의 누구든, 전부 잡아내겠습니다."""
수영만화일기,"백수 겸 만화가지망생 해오, 저질체력에서 벗어나기 위해 수영에 도전!
작심삼일이리라는 예상과는 다르게 어느새 수영에 익숙해진다.
'이게 대체 어떻게 된 일이야? 나…… 수영을 사랑하게 된 걸까?'
그렇게 수영을 익혀가면서 점차 몸도 마음도 성장해나가는데…….
불확실한 미래를 안고 살아가지만, 해오는 오늘도 수영한다."
게임 최강 트롤러,"세상에서 가장 개연성 있는 게임.
아진 전자. 실리코프 인더스트리. 코퍼레이션 아르고스.
세계 굴지의 대기업들이 합작해 만들어 낸 인류 최초의 가상현실 게임 아르카디아.
[환영합니다, 환상의 세계, 아르카디아에 오신 것을.]
그 안에서 벌어지는 대환장스러운 이야기들.
지금 바로 시작합니다!"
이상한 변호사 우영우,"한국대 로스쿨 수석 졸업에,
변호사 시험 성적 1,500점 이상!
국내 업계 2위 법무법인 한바다의 인턴 변호사가 된 우영우.

영우는 자신의 능력을 증명해내고 '진짜 변호사'가 될 수 있을까?"
루루라라 우리네 인생,"시간이 지나면 자연스레 성숙한 으른(?)이 되어 있을 줄 알았는데
그저 술과 음란한 이야기를 좋아하는 알딸딸한 어른이 되어버렸다. 
 
어느날 귀농을 결심한 부모님을 따라 
어쩌다보니 시골과 도시를 오가게 된 현이씨의 인생 제 2막 시작!"
비서 일탈,"""우리가 키스하면 이 관계가 달라지려나?""
로열패밀리의 정석이라 불리는 재경그룹의 장남 이승조와,
그런 그를 짝사랑하는 마음을 숨긴 채 승조의 비서로 일해온 추이연.
그리고 같은 기간 동안, 늘 그녀에게 남자이길 원했던 재경그룹의 사생아 이문조.
어느 한 순간을 계기로 자꾸만 이연에게 다가오는 승조와 늘 그렇듯 이연을 원하는 문조 사이에서 이연의 고민이 시작되는데…!
완벽하지만 짠한 정실소생 도련님 승조와 대놓고 짠한 사생아 도련님 문조, 둘과 위험하게 얽혀버린 비서 이연의 아슬아슬 로맨스."
완벽한 결혼의 정석,"남편이 내 동생을 사랑하고 있었다. 
하필이면 내 생일에 그의 진심을 알아버렸고, 그날 나는 죽었다. 그런데… 1년 전으로 돌아왔다? 
다시 살게 된 그날, 나는 결심했다. 
이번에는 내가 동생의 남자와 결혼하기로. 남은 시간은 1년, 그때까지 완벽한 복수를 해야 하는데… 
그런데 이 남자, 너무 완벽하다. 계약 결혼의 상대인 재벌 2세 서도국. 
그의 눈빛에, 그의 입술에 자꾸만 아찔해진다. ‘나, 어떡하지…?’"
순수한 동거생활,"아침부터 밤까지 두근두근. 집에서도 회사에서도 꽁냥꽁냥! 
오빠의 절친이자 무섭기만 하던 집주인과 같은 회사 같은 팀에 다니게 되었습니다. 
동거만으로도 심장이 떨리는데, 이 남자.. 왜 나한테 잘하지? 무섭게.. 
고군분투 햇병아리 사회 초년생 '오소정'과 
친구의 동생을 사랑하게 된 남자 '차강우'의 옥신각신 동거 이야기."
네가 죽기를 바랄 때가 있었다,"끔찍하게 싫어하는 원수의 딸과 결혼하게 된 황제,
절대 좋아할 수 없다 생각했던 황후에게 예상치 못한 감정을 느끼게 된다."
마왕까지 한 걸음,"""이건 그냥… 마을 사람 A랑 다를게 없잖아…, 나보다 강한 존재는 이 세계에 있을 수 없어!""
세계관 최강자 자리를 위해 지상최강 마왕을 찾아 뭍으로 나온 바다의 왕 유리아.
그런데… 거울을 보니 웬 어린아이가…?
다리를 얻음과 동시에 그녀의 모든 힘이 사라져 버렸다...
그럼에도 여전히 세계최강 자리를 노리고 있는 그녀의 눈물겨운 여정이 시작된다!!"
만능잡캐,"좀비들로 뒤덮여버린 세상. 그런데 이 아포칼립스... 해볼만 하겠는데?!
[전문가에게서 스킬을 '전수'받을 수 있습니다.] 
멘탈케어, 목조건축, 천마신공, 동물교감, 기계공학, 연주 등등.. 배울 게 너무 많아서 문제다! 뭐든 다 잘하는, 준비된 생존자의 질주가 시작된다!"
아인슈페너,"항상 남의 눈치를 살피느라 자신은 뒷전인 민다래. 어느 날 동기들에게 자신의 뒷담화를 듣고 관계의 현타가 오는데, 이 모든 게 자신의 유일한 안식처인 남자친구와 관련이 있다?"
당신의 그림자를 그만두었을 때,"이네스의 전부였던 남편, 라이언.
이네스는 자신의 그림으로 라이언을 <신의 손을 가진 화가>로 만들었고
평생 라이언의 그림자로 살아왔지만 그래도 행복했다.
아니, 행복했었다.
라이언이 불륜을 저지르는 것도 모자라 자신을 죽음에 이르게 하기 전까진.
후회만 가득한 삶이 끝나갈 때, 과거로 돌아왔다.
이네스에게 모든 것을 되찾을 기회가 온 것이다."
개와 사람의 시간,"나영의 행복을 위해서라면, 무엇이든 할 수 있는 사랑스러운 반려견 우비. 
그런 우비와 나영의 시간에 불현듯 개를 무서워하는 낯선 남자 영민이 들어오고, 
나영과 영민의 관계가 가까워질수록 우비와 그녀의 사이는 멀어져 간다. 
나영의 사랑을 독차지할 수 없게 된 우비. 
결국 스스로의 한계를 느끼고 그녀의 곁을 떠나 
자신을 위한 삶을 살기로 결심하게 되는데..."
누나! 나 무서워,"여자에 환장한 남고생 상엽은 처녀귀신을 만나기 위해 강령술(?)을 시도하고, 귀신 소미를 만난다. 그리고 소미 뿐만 아니라 위험한 존재들도 만나게 된다. 위기에 빠진 상엽은 소미를 받아들여 신내림을 받는데, 이로 인해 더 위험한 귀신들이 엮이게 된다. 그리고 소미를 쫓는 저승사자까지 엮이는데... 살인마/귀신/저승사자로부터 살아남기 위한 소미와 상엽의 고군분투가 시작된다."
선남친 후연애,"복학생 선배의 끈질긴 구애로 고통받던 가은은 학교 내 뜬소문으로 오해받고 있던 재림과 합의하에 쇼윈도 커플이 되기로 한다.
진지한 연애는 절대 하지 않기로 했으나 재림은 예상보다 훨씬 달콤하게 다가오고, 가은은 가랑비 젖듯 재림에게 끌리고 마는데… 
쿨 찾다 핫하게 엮여버린 쇼윈도 커플의 간질간질 캠퍼스 로맨스!"
돌아온 여기사,"평범한 백작가 영애로 살아가던 ""이레나"". 그녀의 가문은 반왕 ""파벨루크""로 인해 하룻밤 만에 숙청당하고 만다. 가족의 복수를 위해 냉혹한 기사로 살아가던 그녀는 무슨 이유에서인지 과거로 되돌아가게 되었다.
가족을 끝까지 지키기 위해선 지난 생에서는 죽었던 황태자 “칼라일”을 살려야 한다!
낮에는 레이디, 밤에는 검을 든 기사로 바쁘게 오가는 이레나. 이번에는 미래를 바꿀 수 있을까?!"
케찰코아틀 - 다빗,"카르텔이 장악해 피로 얼룩진 나라 칸디아.
한때 칸디아를 지배하는 카르텔의 외아들이었던 소년은
성인이 되어 나타나 카르텔 간부들을 제거하기 시작한다. 
모든 것의 답이 될, '케찰코아틀'의 정체를 추적하기 위해.

*수요웹툰 <케찰코아틀-헤수스>와 이어집니다."
"이러면 안 돼요, 전하!","황태자를 살리기 위해 회귀를 거듭하게 된 제국 최강의 기사, 로제타. 
거듭되는 회귀에도 실패가 계속되자 이번 생에는 호위기사가 아닌 하녀로 입궁하여 황태자를 곁에서 지키기로 한다. 
하녀가 되어 곁에서 살갑게 모셔서 그런 건지... 까칠하기만 하던 전하가 왠지 다정하게 변한 것 같은데?!"
가족같은 XX,"탑 배우 한나나는 우연히 갈 곳 없는 고등학생 유성우를 집에 들인다.
아슬아슬한 동거가 시작된 가운데, 갑자기 좋아하던 선배 이한이 다가오기 시작하는데..?!
가족 같은 남자와 가족이 되고 싶은 남자, 누가 진짜 가족이 될까?"
위대한 겸상,"어린 시절의 트라우마로 돈가스를 못 먹는 돈가스 재벌 후계자 '유은겸'과 
매우 많이 먹는 앵겔지수 99%의 가난한 공시 준비생 '독고혜상'의 
군침도는 먹방 로맨스."
해시의 신루,"미래를 예언하는 신비한 능력을 가졌으나, 운명을 거부하고 도망치는 해루. 
어느 날 그녀 앞에 엉뚱한 선비가 나타났다! 
천하제일 길치에 공갈을 일삼으며 싸움은 몸이 아니라 머리가 하는 거라 주장하는 해괴한 사내. 
그러나 그를 만난 순간, 해루의 멈춰진 운명이 다시 돌기 시작한다. 
15세기 조선, 실록이 기록하지 못한 조선 최고의 천재 군주와 
운명의 사슬에 매인 신비한 여인의 달콤아슬한 사랑과 전쟁!"
킬더킹,"왕의 재능이란 무엇일까?
왕좌의 새로운 주인, 진정한 왕에 걸맞는 재능을 가려내는 게임이 시작된다!"
1학년 9반,"1학년 9반 친구들은 부푼 설레임을 안고 수학여행을 떠나지만. 일진들의 장난으로 반 전체가 무인도에 표류하게된다.
서로에 대한 불신으로 더 이상 친구가 아닌 적이 되어 버린 1학년 9반 친구들... 과연 그들은 무사히 탈출 할 수 있을까?"
코인 리벤지,"코인 가격을 조작하는 세력에 의해 가족을 잃은 천재 대학생 유범.
복수를 위해 신분을 숨기고 코인 조폭 세력 'ONE'에 잠입한다.
그는 천재적인 두뇌를 활용하여 자신의 인생을 망가트린 코인 세력에게 피의 복수를 시작한다.
<사장님을 잠금해제> 박성현 작가의 가상화폐 범죄 느와르 신작."
방과후 레시피,"음식을 사랑하는 소녀 소금은 꿈에 그리던 요리 고등학교에 합격한다.
학교에 진학하기 위해 이모네 집으로 이사하게 된 소금은 그곳에서 자신에게 상처를 주었던 첫사랑 은재와 재회한다.
우리는 과연 예전처럼 다시 친해질 수 있을까?
요리고에서 펼쳐지는 단짠단짠 순정 로맨스!
2021 '첫사랑을 찾습니다' 로맨스 공모전 대상 수상작."
THE 런웨이,"하룻밤을 같이 보낸 그 남자가 내 상사라고?!
패션지 <The Runway>의 에디터 유지안. 그녀는 약혼자의 양다리 소식에 무작정 파리로 떠난다.
그곳에서 우연히 만난 남자와 충동적으로 하룻밤을 보내 버리고…
3개월의 시간이 흐른 후, 지안의 회사에 만렙의 편집장이 프랑스에서 오게 된다. 그런데 그 남자… 바로 지안과 하룻밤을 보낸 프랑스에서의 그 남자다!!"
"오, 친애하는 숙적","눈엣가시였던 숙적을 처치하고 모든 것을 얻었다고 생각하는 순간, 회귀했다.
이십년 전 자신이 후계자로 임명되기 전으로.

심란해하는 칼미아 앞에 그녀의 오랜 숙적이 다시 나타난다.

숙적 루드베키아는 약혼을 제안하고,
혼란스러워하면서도 칼미아는 자신이 그토록 바라는 후계 자리를 위해 그의 손을 잡는다.

이번 생에도 그녀는 백작이 될 것이다.
제 힘으로 쟁취해서, 오랜 숙적을 물리치고, 누구의 허수아비도 아닌 온전한 백작이."
이게 웬 떡,"대학 생활에 흥미를 잃어가던 공시루는 복학생 설기백의 등장으로 즐거운 캠퍼스 생활과 함께 기백을 향한 남모를 마음을 품어오고 있던 어느날. 
기백의 이상형을 듣고 충격을 먹은 시루는 술로 화풀이를 하다 그 자리에 있던 누군가와 술김에 키스를 하는데...
설기백을 짝사랑 하는 공시루와 그런 공시루와 묘하게 얽히는 조청의 뒤죽박죽 캠퍼스 러브 스토리."
독거미,"부패한 국가 최고 권력을 향한
한 여자의 처절한 핏빛 복수가 시작된다.

달콤한 신혼생활을 만끽 중인 가정주부 임나영.
그러던 어느 날, 남편이 차가운 주검이 되어 돌아오고 강력계 형사였던 남편이 살해당했음을 직감한 임나영은 남편의 복수를 결심하는데...
사실 평범한 주부로 비쳤던 그녀는 탈북 전 암살 및 납치 등 테러 공작을 전담하는 북한의 비밀공작원, 일명 '독거미'라 불리는 특급 킬러였다."
마녀의 심판은 꽃이 된다,"악인에게 악취를 느끼는 선화는 난생처음 향기가 나는 정향을 만나게 된다.
그러나 마냥 선한 줄만 알았던 정향은 악인을 꽃으로 만드는 마녀였는데…
'혹시 죽이고 싶은 사람 있니?'"
나의 불편한 상사,"결혼까지 생각했던 남자친구에게 잠수이별을 당한 세라,
이직 첫날 새 직장에서 남자친구의 뒤통수를 발견하고 냅다 커피를 부었는데
알고 보니 생판 처음 보는 남자, 그리고 앞으로 매일 봐야 할 자신의 상사였다?
일생일대 최대의 위기에 봉착한 오세라의 오피스 로맨스 코미디."
베니루 BAENIRU,"하루하루 죽지 못해 사는 배지현. 
어느 날, 어마어마한 수익을 내는 걸로 유명한 버츄얼 너튜버 ‘베니루’의 목소리가
 자신의 것과 닮았다는 사실을 우연히 알게 되는데..!"
"엔딩, 바꿔보려합니다","배드엔딩만 쓰는 피폐소설작가 변수아는
누군가의 저주로 인해 현재 연재중인 ‘청춘의 끝에’의 악녀 최세화로 빙의된다.
인성파탄자, 소시오패스, 이중인격자, 싸이코패스뿐인 소설 속에서
과연 수아는 살아서 원래 세계로 돌아갈 수 있을까?"
달의 요람,"낯선 나라 유안에 끌려온 멸망국의 포로, 월영.
황궁에서 만난 건 가국을 멸망시킨 유안의 장군 연오와 대 유안 제국의 황제였다.
궁녀에서 황귀비로, 가장 낮은 곳에서 가장 높은 곳으로
거침없이 오르는 월영의 잔혹한 궁중로맨스가 시작된다."
환상연가,"왕을 시해하려다 기억을 잃고 쓰러진 자객이 다음 날 후궁으로 책봉된다면?
반역자로 몰려 몰살당한 연씨 가문의 유일한 생존자 연월은 왕에게 복수하기 위해 자신의 신분을 숨긴 채 자객이 된다.
무희로 잠입해 은밀히 왕의 목을 노리지만, 왕이 쳐 놓은 덫에 빠져 오히려 독한 향에 정신을 잃고 쓰러진다.
다음 날, 연월은 과거의 기억을 잃은 채 눈을 뜨게 되고, 뜻밖에 왕명을 받아 후궁 은효비에 책봉된다.
현왕은 자신을 죽이러 온 자객인 연월을 후궁으로 들인 악희의 소행에 분노하며 후궁전으로 달려가 연월을 죽이려 하지만,
도리어 악희에게 몸의 통제권을 빼앗기고 마는데..."
진짜 진짜 이혼해,"‘강폭풍킥’ 밈의 주인공이 된 후 고개를 들고 다니기 힘들어진 백희. 
한국을 뜨기 위해 호주 영주권자인 한결과 이혼을 전제로 위장 결혼을 한다. 
하지만 이 결혼을 인정받으려면 둘 사이의 ‘진정한 사랑’을 증명해야 한다는데...?! 
진정한 사랑은 무슨, 사기 그 자체인 이 관계를 들키지 않기 위해 안간힘을 쓰지만 쉽지 않다!"
